links,bodies
http://kobieta.wp.pl/worlds-50-best-restaurants-przyznane-na-podium-az-dwie-pozycje-europejskie-6109123820123777a,"World’s 50 Best Restaurants przyznane! Na podium aż dwie pozycje europejskie Po raz kolejny magazyn kulinarny Restaurant, we współpracy z najwybitniejszymi nazwiskami branży gastronomicznej, przyznał nagrodę w plebiscycie World’s 50 Best Restaurants. W pierwszej trójce pojawiły się dwa lokale europejskie. Zwycięstwo przypadło restauracji z Nowego Jorku.  Nagroda World’s 50 Best Restaurants jest uznawana w świecie kulinariów za najbardziej prestiżową i znaczącą. Restauracja może zyskać prawdziwy rozgłos, a jej notowania szybują w górę. Tytuł przyznawany od 2002 roku na podstawie ankiety wypełnianej przez najlepszych na świecie kucharzy, restauratorów, krytyków kulinarnych i smakoszy jest ważniejszy nawet od Gwiazdki Michelina. Obecnie w jury konkursu znajduje ponad ośmiuset ekspertów, którzy muszą odwiedzić restauracje startujące w plebiscycie w trakcie osiemnastu miesięcy przed wydaniem werdyktu. Następnie głosują na restaurację zarówno ze swojego regionu, jak i spoza niego. Pierwszym w historii tego konkursu lokalem, który zdobył tytuł najlepszej restauracji świata, było El Bulli z hiszpańskiego Roses. Ubiegłorocznym laureatem była Osteria Francescana mieszcząca się w Modenie we Włoszech.  Rok 2017 okazał się szczęśliwy dla nowojorskiej Eleven Madison Park. Na podium trafiła również ubiegłoroczna laureatka, Osteria Francescana, zaś trzecie miejsce przypadło w udziale El Celler De Can Roca z Hiszpanii. Zestawienie zamyka belgijska Hof Van Cleve.  Eleven Madison Park prowadzony jest przez Daniela Humma, który zdobył już trzy Gwiazdki Michellin. Lokal serwuje wykwintne dania sezonowe i stawia na bezpośredni kontakt z gośćmi, przez co odwiedziny w nim zyskują miano prawdziwie niesamowitego doświadczenia. Rezerwacja niestety nie należy do najłatwiejszych. Na miejsce trzeba czekać ponad miesiąc.   Niestety w żadnej z edycji nie doczekaliśmy się jeszcze polskiego przedstawiciela, jednak liczymy na to, że w przyszłym roku się uda."
http://kobieta.wp.pl/reklama-kostiumow-kapielowych-tylko-bez-photoshopa-6109080567731841a,"Reklama kostiumów kąpielowych? Tylko bez Photoshopa! Dla większości marek oferujących bieliznę i kostiumy kąpielowe rzeczą oczywistą jest używanie Photoshopa podczas pracy nad kampanią reklamową. Poprawiane są nie tylko delikatne niedoskonałości skóry czy produktu, ale często całe wymiary modelki. Kult idealnego ciała zdaje się na dobre panować w świecie mody. Marka Aerie postanowiła z niego zrezygnować i pójść w kierunku całkowitej naturalności. Czy słusznie?  Zbliżające się lato napawa przerażeniem tysiące jeśli nie miliony kobiet, które usiłują zyskać perfekcyjną opaleniznę, opanować zasady dokładnej depilacji i przede wszystkim zaakceptować swoje ciało takim, jakim jest. Wszechobecne w mediach modelki w rozmiarze 34 na pewno nie pomagają im w walce z kompleksami. W przeciągu ostatnich lat nastąpił jednak znaczący przełom, który udowadnia, że rozmiary powyżej 42 też są sexy!    Tego zdania jest wspomniana wyżej marka Aerie, która w swoich kampaniach podkreśla piękno kobiecego ciała w każdym możliwym rozmiarze. W postprodukcji zdjęć nie stosuje żadnego retuszu, dlatego w pełnej krasie widoczne stają się rozstępy, cellulit i fałdki modelek. Mało tego, firma Aerie aktywnie wspiera walkę z zaburzeniami żywienia wraz z National Eating Disorders Association. Za każde nieretuszowane zdjęcie na Instagramie, przedstawiające kobiece ciało w naturalnej odsłonie, opatrzone hashtagiem #AerieREAL, marka przekazuje jednego dolara dla NEDA.  Jednak to nie pierwszy przypadek w świecie mody, kiedy uwaga skupia się na akceptacji swojego ciała wraz z jego niedoskonałościami. Iskra Lawrence, popularna modelka plus-size w licznych wywiadach nawołuje do tego, żeby kochać siebie w każdym możliwym wydaniu. W styczniu br. opublikowała na swoim Instagramie zdjęcie pokazujące ją w dwóch odsłonach. Różnica między ujęciami zdecydowanie rzuca się w oczy, a sama zainteresowana pisze: „Chciałam pokazać, jak wygląda moje ciało, gdy jestem zrelaksowana i jak łatwo można manipulować wizerunkiem kobiecego ciała. Od 13 lat pracuję jako modelka i wszystkie zdjęcia w bieliźnie, do których pozowałam, zrobiono, gdy stałam wyprostowana i mój brzuch był płaski. Dopiero później zrozumiałam, że to, że mam fałdki, nie oznacza, że nie jestem piękna”.    Kolejnym świetnym przykładem walki z modelkami-wieszakami była impreza UK Plus Size Fashion Week, która odbyła się na kilka dni przed Londyńskim Fashion Week, podczas której na wybieg wstęp miały tylko modelki w rozmiarze powyżej 40. – Naszą misją nie jest propagowanie otyłości, ale celebrowanie krągłości i kobiet o różnych kształtach- mówi Rianne Ward, organizatorka całego zamieszania. Jedną z gwiazd tego pokazu była Olivia Campbell, która nosi ubrania w rozmiarze 50.  Agnieszka Czerwińska, autorka książki „Śmierć grubej Berty”, w której opisuje zmagania z otyłością w rozmowie z nami przekonuje jednak, że najważniejszy w promowaniu krągłości jest rozsądek. – Plus size nie powinien polegać na pochwale otyłości. Jednak kobiety w rozmiarze 40-50 nie są otyłe. Są krągłe. Powinniśmy skupić się na promocji zdrowego stylu życia i aktywności fizycznej. Zdrowe ciało z krągłościami zawsze będzie bardziej atrakcyjne niż wychudzone i nieszczęśliwe- tłumaczy.    Z drugiej strony autorka nie wierzy, że świat mody zdominują kobiety w rozmiarze plus-size, dopóki nie będziemy więcej mówić w mediach o akceptacji kobiet większych i pełniejszych. –Dopóki młode kobiety na Instagramie będą wzorować się na modelkach w rozmiarze 34 nie ma szans, żeby zaakceptowały swoje fałdki i cellulit na udach. Na jednym z prowadzonych przeze mnie wykładów w szkole gimnazjalnej podeszła do mnie dziewczyna, która była bardzo szczupła z pytaniem jak schudnąć. Akceptacja swojego ciała powinna płynąć przede wszystkim z wiedzy na ten temat, którą młodym kobietom musi zacząć przekazywać otoczenie-.  Czy propaganda marki Aerie ma szansę zwrócić uwagę świata mody na odejście od stereotypu idealnego ciała? Zdecydowanie może przybliżyć nas do tego, żeby mała fałdka na brzuchu nie doprowadzała nastolatek do płaczu i pozwolić na pokochanie siebie w każdym wymiarze."
http://kobieta.wp.pl/anna-kalczynska-nie-mam-sily-ani-czasu-by-chodzic-po-sklepach-korzystam-z-pomocy-stylistki-5985247207850625a,"Anna Kalczyńska: Nie mam siły ani czasu, by chodzić po sklepach. Korzystam z pomocy stylistki Podoba wam się styl dziennikarki? Odkąd Anna Kalczyńska została prezenterką ""Dzień Dobry TVN"" znalazła się w centrum zainteresowania mediów, a jej stylizacje często analizowane są w najdrobniejszych szczegółach. Dziennikarka zdradziła, że w kształtowaniu wizerunku zdaje się na pomoc stylistki. Twierdzi, że sama nie ma czasu ani ochoty na odzieżowe zakupy przed oficjalnymi imprezami. Za wizerunek Anny Kalczyńskiej odpowiada stylista Alicja Napiórkowska. To ona wybiera dla niej kreacje na oficjalne wyjścia. Dziennikarka twierdzi, że przy tempie życia jakie prowadzi, pomoc stylistyki jest niezbędna. - Nie miałabym zwyczajnie już siły ani czasu na to, żeby jeszcze latać po sklepach i wybierać jakieś propozycje, kreacje i dopasowywać je do swojego stylu - mówi prezenterka. Na co dzień prezenterka wybiera luźne stylizacje. Zwłaszcza w kwestii obuwia stawia na wygodę. Szpilki zakłada głównie na wieczorne wyjścia i wtedy jest w stanie kupić bardzo dość drogą parę. - Na co dzień biegam z trójką dzieci, więc muszę przede wszystkim czuć się wygodnie i komfortowo, żeby po prostu czuć się w tym i odpowiednio, i żeby móc podbiec, jeśli to jest konieczne, czy wejść do piaskownicy - tłumaczy Kalczyńska. Podoba wam się styl dziennikarki?"
http://kobieta.wp.pl/jak-prawidlowo-myc-i-odzywiac-wlosy-6109461291792513a,"Jak prawidłowo myć i odżywiać włosy?  Po zimie włosy bywają osłabione i matowe. By przywrócić im siłę i blask, najważniejsza jest odpowiednia pielęgnacja. Dlaczego należy dwa razy myć głowę i jak prawidłowo osuszyć włosy, wyjaśnia Piotr Wasiński, stylista fryzur. - Dziewczyny, które przychodzą do mnie do salonu, zawsze marzą, by mieć włosy jak z okładki - wyznaje Piotr Wasiński. -  Chcą być jak gwiazdy. Każda zadaje mi to samo pytanie: co zrobić, by mieć piękne włosy. Sekret to pielegnacja. Najważniejsze, żeby rozpoznać, jaki mamy rodzaj włosów - suche, cienkie, normalne czy grube. - Jeżeli mamy bardzo cienkie włosy i użyjemy zbyt mocnego produktu, mamy efekt tłustych, ciężkich włosów. Jeżeli nałożymy na grube włosy zbyt lekki produkt, będą się puszyć i nie będą nawilżone - dodaje stylista fryzur."
http://kobieta.wp.pl/takiego-wyroku-jeszcze-nie-bylo-fryzjerka-zaplaci-10-tys-zl-za-zniszczenie-wlosow-klientki-6105950867612801a,"Takiego wyroku jeszcze nie było. Fryzjerka zapłaci 10 tys. zł za zniszczenie włosów klientki Miało być idealnie. Przed zabiegiem miała rozjaśnione blond włosy do ramion, w dodatku cienkie i suche. Chciała coś zmienić, więc zdecydowała się na trwałą ondulację. Po raz pierwszy w życiu. Po zabiegu włosy jej wypadały, końcówki były całkiem spalone. Sprawa ciągnęła się w sądzie przez trzy lata. Teraz fryzjerka odpowiedzialna za feralny zabieg będzie musiała zapłacić wysokie zadośćuczynienie.  - Z uwagi na rzeczywisty rozmiar cierpień kwota 10 tys. zł nie jest żądaniem wygórowanym – mówił cytowany przez „Gazetę Wyborczą” sędzia Michał Sznura. W Gdańsku zapadł właśnie wyrok w sprawie fryzjerki, która zniszczyła włosy swojej klientce. Wszystko zaczęło się w marcu 2014 roku. Ania (imię zmienione) przyszła do jednego z gdańskich salonów fryzjerskich, by zmienić coś w swoim wyglądzie. Takich efektów nie mogła się jednak spodziewać. Dziewczyna zdecydowała się na trwałą ondulację. – Po zabiegu włosy napuszyły się i nie chciały układać, były wysuszone, połamane, a końcówki spalone – zeznała przed sądem.  Włosy miały „fruwać po całym mieszkaniu”, nie dało się ich ułożyć, na nic zdawały się odżywki od sąsiadki z bloku. – Wycofałam się z życia towarzyskiego, wstydziłam swojego wyglądu. Ale musiałam chodzić do pracy. Wychodząc z domu, zakładałam kaptur i straciłam pewność siebie. Zrezygnowałam z jazdy na rolkach, nawet latem naciągałam na głowę czapkę. Jestem pielęgniarką, więc wciąż odpowiadałam na pytania pacjentów, którzy chcieli wiedzieć co się stało – cytuje „GW”.  Dziewczyna postanowiła wnieść pozew przeciwko fryzjerce. Ta miała zapłacić jej w ciągu trzech dni 10 tys. zł zadośćuczynienia za doznane krzywdy. I tak zaczęła się sądowa batalia o to, kto za wygląd włosów odpowiada. Sprawą zajął się Sąd Rejonowy Gdańsk-Północ. Powołano biegłych z zakresu fryzjerstwa, którzy mieli orzec, kto ponosi odpowiedzialność za skutki zabiegu. Fryzjerka do winy się nie przyznawała. Przed sądem twierdziła, że ondulacji nie wykonała, a jedynie nawilżyła swojej klientce włosy i uczesała je. Przeczyły temu jednak dowody – w tym nagrania z monitoringu i zeznania świadków. 
Jak ocenili biegli, zabieg przeprowadzono nieprawidłowo. Przy trwałej czas aplikacji płynu na zniszczone włosy wynosi nie więcej niż 20 minut, a dodatkowo trzeba użyć specjalnego płynu. U Ani aplikacja trwała około dwóch godzin. Łatwo można więc wyobrazić sobie, jak zniszczone były włosy dziewczyny. Na pełen odrost trzeba czekać w takich przypadkach nawet dwa lata.  Jak przyznał teraz sąd, fryzjerka powinna odmówić wykonania zabiegu, a co najważniejsze zachować staranność przy pracy.  - Powódka została pozbawiona swojego atrybutu w postaci półdługich włosów, które częściowo wypadały. Poszkodowana unikała ludzi, straciła poczucie własnej wartości. Do tej pory leczy się psychiatrycznie. Powódka celem poprawy wyglądu włosów i zwiększenia swojej atrakcyjności, udała się do salonu pozwanej. Dla kobiety to jak wygląda jest ważne. Właśnie po to, by wyglądać jeszcze atrakcyjniej udała się do pozwanej. Dlatego niewątpliwie wypadanie włosów powodowały u powódki istotny dyskomfort – napisał sąd. Teraz gdańszczanka musi zapłacić 10 tys. złotych zadośćuczynienia. Wyrok jednak nie jest prawomocny. Fryzjerka już odwołała się od decyzji sądu.  To pierwsze tak wysokie zadośćuczynienie dla klientki salonu fryzjerskiego. Ostatnio głośno było także o historii Barbary, dla której wizyta w jednym z krakowskich salonów fryzjerskich zakończyła się oparzeniem trzeciego stopnia. Jak informowały lokalne media, kobieta do ołtarza poszła z rozległą raną na głowie i doczepionymi włosami. Przez trzy lata walczyła ze skutkami wizyty w salonie. Barbarze wypłacono 8,5 tys. złotych odszkodowania, tymczasem koszty jej leczenia wynosiły ponad 30 tys. złotych."
http://kobieta.wp.pl/co-zrobic-gdy-fryzjer-zniszczy-nam-wlosy-6108783802570881a,"Co zrobić, gdy fryzjer zniszczy nam włosy? Jak i kiedy reklamować usługę fryzjerską? Powiedzieli o tym prawnik Eliza Kuna oraz stylista fryzur Maciej Maniewski.  Ostatnio głośno było o wyroku, na mocy którego fryzjerka musi zapłacić klientce 10 tys. zł zadośćuczynienia za nieudany zabieg trwałej ondulacji. Podobno kilku stylistów, których wcześniej odwiedziła kobieta, odmówiło wykonania tej usługi. Jej włosy były bowiem zbyt słabe, by ""wytrzymać"" taki zabieg.  - Często odmawiamy klientom niektórych usług - mówi Maciej Maniewski. - Coraz częściej prosimy klientów o specjalne oświadczenia, że pewne rzeczy wykonujemy na ich odpowiedzialność. Co jednak w przypadku, gdy nożyczki i farba już poszły w ruch, a efekt zabiegów zdecydowanie nas nie zadawala? - Przysługują nam dwa roszczenia: roszczenie o odszkodowanie i roszczenie o zadośćuczynienie - tłumaczy Eliza Kuna. - To są często pojęcia mylone przez klientów. Odszkodownie to jest to jest ta szkoda, której doświadczyliśmy, czyli np. koszt naszej usługi fryzjerskiej plus koszt drugiej usługi fryzjerskiej, która to naprawiała i ewentualnie koszty dojazdów czy utracone zarobki (w związku z tym, że poszliśmy na zwolnienie lekarskie). Ta kwota z reguły jest niższa, ponieważ rekompensuje wprost koszty, które ponieśliśmy. Druga kwota, która jest wyższa, to jest zadośćuczynienie, czyli rekompensata za cierpienie psychiczne. W Stanach te kwoty idą w miliony. W Polsce pozwy przeciwko fryzjerom to przypadki sporadyczne, a zadośćuczynienia wynoszą kilka, kilkanaście tysięcy złotych."
http://kobieta.wp.pl/kuba-wojewodzki-zaskoczyl-wszystkich-nowa-fryzura-w-takiej-wersji-jeszcze-go-nie-widzialyscie-6108733214160513a,"Kuba Wojewódzki zaskoczył wszystkich nową fryzurą. W takiej wersji jeszcze go nie widziałyście Kuba Wojewódzki wciąż nie przestaje nas zaskakiwać. Znany z ekscentrycznego zachowania prezenter pokazał się w nowej fryzurze, która wzbudziła spore poruszenie w mediach społecznościowych. Po raz pierwszy mamy okazję zobaczyć go w rudej peruce. Czyżby showman chciał zatuszować swój kompleks? Nie od dziś mówi się o tym, że Kuba Wojewódzki jest przewrażliwiony na punkcie wyglądu. Przypomnijmy, że już kilka lat temu tygodnik Newsweek ujawnił jego wstydliwą tajemnicę, czyli pierwsze oznaki łysienia. Podobno z tego względu król TVN-u zatrudnił wtedy własnego stylistę fryzur. Miał on zajmować się zakrywaniem jego łysiny przy użyciu cienia do powiek w kolorze włosów.  Myślicie, że ten problem nadal spędza mu sen z powiek? Pod swoim najnowszym zdjęciem w długich włosach showman napisał: ""A może by tak rzucić wszystko i zostać piękną kobietą?"". W komentarzach pod postem nie zabrakło zabawnych wpisów jego fanów. Niektórzy porównywali go do Anny Grodzkiej, a inni do jego narzeczonej, Renaty Kaczoruk. A jak wy oceniacie nową fryzurę Wojewódzkiego?"
