links,bodies
http://kobieta.wp.pl/sprawdz-czy-twoj-facet-jest-uzalezniony-od-porno-6109122348468353a,"Sprawdź czy twój facet jest uzależniony od porno Liczba uzależnionych od pornografii rośnie w zatrważającym tempie. Rozkwit pornobiznesu w Internecie spowodował, że dołączają do nich osoby coraz młodsze: nastolatkowie i dzieci. W grupie uzależnionych w zdecydowanej większości są mężczyźni.  Co to oznacza dla twojego związku? Spore prawdopodobieństwo, że twój mężczyzna może mieć problem, a już nie miej złudzeń, że nigdy z pornografią nie miał do czynienia. W myśl starego porzekadła: „Wszystko jest dla ludzi”, pornografia dozowana mózgowi w jakichś rozsądnych dawkach i celu, nie uczynią zaraz z twojego faceta pornoholika. Są jednak sygnały, które w jednoznaczny sposób wskazują, że cienka granica między konsumowaniem pornografii dla doraźnych korzyści, a uzależnieniem od niej została przekroczona.  Całego godziny przed ekranem
Osoba uzależniona od pornografii potrzebuję jak najczęstszego kontaktu z nią. Polega to na tym, że gdy tylko może, przesiaduje przed monitorem komputera non stop. Najczęściej w godzinach wieczornych i późnowieczornych, kiedy ustają wszelkie zobowiązania dnia, ale to nie jest oczywiście regułą. Pornoholicy oglądają filmiki w pracy i na własnych nośnikach w czasie drogi do pracy czy przerwy na lunch. Tzw. wolny czas przeznaczany jest na obcowanie z porno, który wypiera jakiekolwiek inne formy aktywności. Oczywiście, to oglądanie czemuś służy.  Osoba uzależniona osiąga w ten sposób podniecenie i – jeśli można to tak w ogóle nazwać –  formę satysfakcji seksualnej, w postaci np. kompulsywnego masturbowania się. Jeśli Twój partner woli siedzieć do późnej nocy przed lapkiem, niż spędzić ten czas z tobą na miłosnych igraszkach, sprawdź, czy nie ogląda pornografii, która z impetem zarazy rozprzestrzenia się po zwojach mózgowych zgłodniałych wrażeń wizualnych mężczyzn, dla których pikantne obrazki z neta i wygibasy cyberkochanków we wszelkich możliwych konfiguracjach stają się żałosnym substytutem sztuki kochania.  Ars amandi do poprawy
Mężczyźni uzależnieni od pornografii stają się z czasem kiepskimi kochankami. Nie mają ochoty poświęcać czasu ani na grę wstępną, ani na dobry seks. Są skoncentrowani na sobie i na własnych potrzebach. Nasycenie, jakie osiągają dzięki porno jest oczywiście złudne, ponieważ - jak to w każdej spirali uzależnienia bywa: im mocniej czegoś pragniesz, w tym mniejszym stopniu zaspokaja cię to, co dostajesz i musisz sięgać po więcej i więcej. Pornoholik goni zatem za coraz większymi doznaniami z sieci, a przed bliskością z tobą wykręca się jak przed dentystą. Nabiera też błędnego przekonania o tym, jak dobry seks w ogóle powinien wyglądać. Zwłaszcza bardzo młodzi osobnicy płci brzydszej usiłują powielić w łóżku schematy, które zaobserwowali w pornosach. Taka edukacja seksualna ma fatalne skutki. Realne życie intymne z kobietą leci na łeb i o tworzeniu satysfakcjonującego związku seksualnego, zapomnij!  Jesteś mi niepotrzebna!
Mężczyźni uzależnieni od pornografii to często zapaleni „masturbatorzy”. Z im większą częstotliwością onanizują się, z tym mniejszą częstotliwością możesz liczyć na ich udaną obecność w waszym wspólnym łóżku. Jak dowodzą seksuolodzy, kompulsywne masturbowanie się nie rzadko jest naturalną konsekwencją uzależnienia od porno. Na dodatek, pornoholikowi potrzeba coraz silniejszych bodźców i – o czym już wiesz - poszukuje w sieci coraz mocniejszych wrażeń, z prezentacją różnych dewiacji włącznie. Niekiedy taki delikwent usiłuje włączyć cię w swoje „gierki i zabawki” i oczekuje, że będziesz niczym wygolony wamp z ostatniej odsłony, którą zdążył obejrzeć przed powrotem z pracy czy uczelni. Nie daj się w to wkręcić! Pornoholika trzeba zaprowadzić do specjalisty, który rozpocznie wcale niełatwy proces leczenia. Im szybciej się opamięta, tym lepiej i dla niego, i dla waszego związku. Wiele całkiem nieźle funkcjonujących par poległo na minie pod nazwą pornografia. U osób uzależnionych od pornografii pojawiają się bowiem neurologiczne zmiany w mózgu, porównywalne ze zmianami u osób uzależnionych od narkotyków czy alkoholu. Im wcześniej takie zmiany w mózgu zachodzą, tym trudniejsza jest potem praca, aby te zmiany odwrócić. Z tego powodu tak ważne jest objęcie szczególną ochroną właśnie dzieci i młodzież, która za chwilę będzie tworzyć swoje intymne relacje."
http://kobieta.wp.pl/jak-schudnac-po-czterdziestce-5982756504224897a,"Jak schudnąć po czterdziestce? Jeśli przekroczyłaś 40. rok życia, pewnie zauważyłaś, z jakim trudem przychodzi ci zrzucanie kilogramów. Twoja przemiana materii nie jest już tak sprawna jak kiedyś. Masz większy apetyt, szybciej męczysz się podczas ćwiczeń. Czy to znaczy, że jesteś skazana na życie z nadwagą? Niekoniecznie. Razem z dietetykiem podpowiadamy, jak schudnąć w dojrzałym wieku. Jeśli przekroczyłaś 40. rok życia, pewnie zauważyłaś, z jakim trudem przychodzi ci zrzucanie kilogramów. Twoja przemiana materii nie jest już tak sprawna jak kiedyś. Masz większy apetyt, szybciej męczysz się podczas ćwiczeń. Czy to znaczy, że jesteś skazana na życie z nadwagą? Niekoniecznie. Razem z dietetykiem podpowiadamy, jak schudnąć w dojrzałym wieku.\r\n\r\n- Każdy moment na wprowadzenie zmian w sposobie odżywiania jest dobry, niezależnie od tego, ile mamy lat. Im wcześniej o tym pomyślimy, tym więcej korzyści dla naszego zdrowia – uważa Joanna Sobczak, dietetyk Naturhouse.\r\n\r\nNie da się jednak ukryć, że im jesteś starsza, tym trudniej osiągnąć sukces w odchudzaniu. Od produktów, które mogłaś jeść jako dwudziestolatka, teraz musisz trzymać się z daleka, bo błyskawicznie odkładają się w postaci tkanki tłuszczowej. Lekarze szacują, że po przekroczeniu czterdziestki metabolizm spada o ok. 5 proc.\r\n\r\nDietetyk Joanna Sobczak przyznaje, że z wiekiem trudniej jest walczyć z nadmiarem kilogramów – ma to związek z biologią. - Przemiana materii staje się coraz wolniejsza, masa mięśni zmniejsza się przy jednoczesnym wzroście tkanki tłuszczowej, a stopniowy przyrost kilogramów staje się problemem, nie tylko estetycznym, ale i zdrowotnym.\r\n\r\nJeśli więc masz 40-50 lat, a chcesz odchudzać się tak samo jak wtedy, gdy byłaś dwudziestolatką, nie osiągniesz sukcesu. Składa się na to wiele czynników. Również menopauza. To czas, gdy kobieta tyje bardzo szybko, najczęściej zyskując tłuszczyk w okolicy brzucha – ma to związek ze spadkiem poziomu hormonów płciowych.\r\n\r\nPo czterdziestce zwykle też mniej się ruszamy, ale nawyki żywieniowe pozostają takie same. Efekt jest taki, że zaczynamy tyć.\r\n\r\n- Z obserwacji dietetyków wynika, że im dłużej utrzymujemy nadmierną masę ciała, tym dłużej trwa cały proces odchudzania, a przede wszystkim etap stabilizacji wagi. Z wiekiem zarówno aktywność fizyczna, jak i zapotrzebowanie organizmu się zmniejszają, dlatego też jest szczególnie ważne, aby cały proces utraty kilogramów przeprowadzić umiejętnie, najlepiej pod okiem specjalisty – zaznacza dietetyk Naturhouse.\r\n\r\nSpecjalistka przyznaje, że w przypadku dojrzałych kobiet, które chciałyby schudnąć, bardzo często stosowane są diety kompletnie niedopasowane do zapotrzebowania organizmu, trybu życia, wieku czy preferencji smakowych. - Nierzadko jadłospisy znalezione w internecie lub prasie są bardzo monotonne albo po prostu skomplikowane i trudne w realizacji. Zwykle oczekujemy też natychmiastowych, spektakularnych wręcz efektów, a kiedy ich nie ma, pojawia się rozczarowanie i frustracja – nie kryje Joanna Sobczak.\r\n\r\nW jaki zatem sposób trzeba się odchudzać po czterdziestce? Żelazną zasadą dla osób w tym wieku jest regularne spożywanie posiłków – po to, aby pobudzić spowolniony metabolizm lub go wyregulować. - Jedzenie śniadań jest niezbędne do utrzymania właściwej masy ciała, ale każdy kolejny posiłek również jest bardzo istotny - podkreśla dietetyczka.\r\n\r\nOprócz trzech głównych posiłków (śniadania, obiadu i kolacji) w menu powinny pojawić się dwie przekąski, czyli drugie śniadanie i podwieczorek. Odstępy między posiłkami powinny być nie mniejsze niż dwie i pół godziny, ale też nie większe niż cztery godziny. - Taki rozkład dostarczanej energii stymuluje organizm do pracy, daje także możliwość regeneracji oraz odpowiedniego przyswojenia składników odżywczych – tłumaczy Joanna Sobczak.\r\n\r\n"
http://kobieta.wp.pl/zaluje-ze-w-mlodosci-nie-przywiazywalam-wagi-do-swojego-ciala-jak-zadbac-o-sylwetke-poki-nie-jest-za-pozno-6109094298007681a,"""Żałuję, że w młodości nie przywiązywałam wagi do swojego ciała"". Jak zadbać o sylwetkę póki nie jest za późno? Brakuje ci motywacji do pracy nad własną sylwetką i zmiany nawyków żywieniowych? Zapewniamy cię, że po przeczytaniu tego tekstu zmienisz podejście do swojego ciała. Niech ten eksperyment stanie się dla ciebie inspiracją do działania. Czas zadbać o siebie, póki nie jest za późno. Na jednym  z brytyjskich forów zapytano osoby w różnym wieku o to, czego najbardziej żałują w swoim życiu. Najczęściej powtarzało się kilka odpowiedzi. Wielu internautów żałowało, że nie starali się utrzymywać częstszych kontaktów z ludźmi, którzy już odeszli. Inni nie mogli pogodzić się z tym, że zbyt długo pracowali, a za mało czasu spędzali w towarzystwie rodziny i znajomych. Większość tego typu wyznań była do przewidzenia, ale jednej odpowiedzi zdecydowanie się nie spodziewałyśmy.  Okazuje się, że starsze osoby często żałują, że nie dbały w młodości o swoje ciało. Zamiast jeść zdrowo i regularnie ćwiczyć, wolały oddawać się przyjemnościom, dlatego do dziś nie mogą uporać się z otyłością. Oto dwie przykładowe wypowiedzi użytkowników, które pojawiły się na forum Reddit:
- Mój niezdrowy styl życia spowodował, że dziś trudno mi jest utrzymać szczupłą sylwetkę. Teraz, gdy jestem stary, muszę wkładać mnóstwo wysiłku, aby schudnąć. Niestety efekt nadal jest mizerny.
- Nie mogę sobie wybaczyć, że nie przywiązywałam wagi do swojego ciała. Przez to, że w młodości o siebie nie dbałam, na starość jestem gruba. Dietatyczka Joanna Sobczak potwierdziła, że z wiekiem trudniej jest walczyć z nadmiarem kilogramów:
- Każdy moment na wprowadzenie zmian w sposobie odżywiania jest dobry, niezależnie od tego, ile mamy lat. Nie da się jednak ukryć, że im jesteś starsza, tym trudniej osiągnąć sukces w odchudzaniu. Od produktów, które mogłaś jeść jako dwudziestolatka, teraz musisz trzymać się z daleka, bo błyskawicznie odkładają się w postaci tkanki tłuszczowej. Lekarze szacują, że po przekroczeniu czterdziestki metabolizm spada o ok. 5 proc. Mimo wdrożenia zasad zdrowego żywienia i aktywności fizycznej, efekty u osób, które skończyły 40. rok życia zwykle już nie są zadowalające. Ten fakt daje wiele do myślenia. Najlepiej więc już w młodości wdrożyć kluczowe zasady, by w przyszłości nie mieć problemu z otyłością. Zacznij od zdrowych śniadań: - Jedzenie śniadań jest niezbędne do utrzymania właściwej masy ciała, ale każdy kolejny posiłek również jest bardzo istotny. Oprócz trzech głównych posiłków (śniadania, obiadu i kolacji) w menu powinny pojawić się dwie przekąski, czyli drugie śniadanie i podwieczorek. Odstępy między posiłkami powinny być nie mniejsze niż dwie i pół godziny, ale też nie większe niż cztery godziny - podkreśla dietetyczka Joanna Sobczak.  Każda forma aktywności fizycznej jest dobra dla ciała, pod warunkiem, że wykonujemy ją regularnie. Jazda na rowerze, szybki spacer czy bieganie to tylko kilka z wielu propozycji, które nie wymagają od nas wcześniejszych przygotowań ani specjalnych umiejętności. Teraz, kiedy dni są dłuższe i cieplejsze, warto wyjść na świeże powietrze i zadbać o swoją sylwetkę. Polecamy także: Jak schudnąć po czterdziestce?"
http://kobieta.wp.pl/nie-musisz-kochac-sie-na-sucho-6108768812230273a,"Nie musisz kochać się „na sucho”! Suchość pochwy to zmora kobiet w okresie menopauzy. Przede wszystkim powoduje ogromny dyskomfort podczas współżycia. Na szczęście są metody, które z powodzeniem eliminują ten problem. Jeśli skorzystasz z nich z rozsądkiem, poczujesz się dużo lepiej. Panie doktorze: jak pan myśli? Na jaką przypadłość skarżą się najczęściej kobiety w okresie klimakterium?Dr n. med. Grzegorz Południewski: Na dyskomfort przy współżyciu wywołany suchością pochwy. To dolegliwość, która może zdominować inne objawy, a często też pojawia się jeszcze przed wystąpieniem klimakterium. I nie jest to błahy problem, ponieważ dotyczy kobiet, które są w sile wieku i czerpią z życia garściami. Mam tu na myśli osoby powyżej 45 roku życia, choć średnia wieku występowania menopauzy w Europie wynosi 52 lata. A jak kobieta czuje ból podczas stosunku, ponieważ pochwa nie jest odpowiednio nawilżona, zaprzestaje współżycia, osłabia się więź z partnerem, pojawiają się negatywne myśli na temat własnej atrakcyjności. Idealny grunt pod stany depresyjne, a nawet pragnienie wycofania się z aktywnego życia. Dlaczego dochodzi do tego przykrego objawu podczas przekwitania?
Za wszystko odpowiedzialne są hormony, a w tym przypadku ich zanikanie. Konkretnie – estrogenów. To ich spadek w organizmie powoduje cały szereg objawów, na które uskarżają się panie w czasie klimakterium. Jednym z nich jest właśnie suchość pochwy. Jak poradzić sobie z tym dyskomfortem?
Są dwie podstawowe metody. Pierwsza z nich to zastępcza terapia hormonalna, która uzupełnia zanikające estrogeny. Druga: preparaty dostępne w aptekach, różne żele i maści, niekiedy z dodatkiem hormonów, których zastosowanie poprawia doraźnie komfort podczas stosunku, ale nie likwiduje problemu. Czy to oznacza, że hormonoterapia jest bardziej wskazana?
Zdaję sobie sprawę z uprzedzeń wobec niej. Jak każda metoda lecznicza ma ona swoje plusy i minusy. Wiele się mówi o jej negatywnym skutkach w postaci wzrostu ryzyka raka piersi czy chorób wieńcowych i zapalenia żył. Amerykańskie Stowarzyszenie ds. Menopauzy podważyło również teorię, że stosowanie hormonoterapii zmniejsza ryzyko wystąpienia alz, co kiedyś było podnoszone in plus. Warto jednak mieć świadomość jej dobroczynnego wpływu na organizm i psychikę. Uzupełnienie estrogenów zapobiega rozwojowi groźnej choroby późnego wieku, czyli osteoporozy czy raka jajnika, a przede wszystkim minimalizuje te wszystkich typowe objawy menopauzy, do których należy również suchość pochwy. Terapia hormonalna poprawia również ogólne samopoczucie kobiety, zmniejsza ryzyko wystąpienia depresji oraz znacząco wpływa na polepszenie się jej życia seksualnego.
Musimy pamiętać, że obecnie żyjemy dłużej. Kobiety 45-50 letnie są dziś w połowie swojego życia. Czy nie lepiej spędzić jego resztę w komforcie zdrowia pojmowanego jako nasz dobrostan zarówno fizyczny, psychiczny i emocjonalny?  Są panie, które mają opory przed terapią hormonalną.
W Polsce boimy się hormonów, ale to jakiś irracjonalny lęk. Bez dobrej i sprawnej gospodarki hormonalnej nie ma dobrego zdrowia. Skorą są sprawdzone metody, którą mogą nam pomóc, sięgnijmy po nie. Oczywiście, hormonoterapia nie jest panaceum na wszystko. Wymaga swego rodzaju dyscypliny. Należy przestrzegać zleconych przez lekarza badań, USG narządów rodnych i piersi, mammografii, cytologii - i wykonywać je systematycznie. Profilaktyka i rozsądek oraz świadomość swoich potrzeb – to powinno charakteryzować każdą kobietę, która chce cieszyć się dobrym zdrowiem przez całe swoje życie i w jego różnorodnych sferach, równie tej seksualnej."
http://kobieta.wp.pl/kiedy-jeszcze-ratowac-a-kiedy-juz-pogrzebac-zwiazek-6108433694124161a,"Kiedy jeszcze ratować, a kiedy już pogrzebać związek? Odejdź, kiedy cię bije i pije. Daj mu szansę, gdy mówi, że kocha i chce rozpocząć sensowną pracę nad sobą. Nie bądź mu dłużna! Joanna Weyna: Pary, które są u pani w terapii, częściej się schodzą czy rozstają?Marta Jankowska, psychoterapeutka integracyjna: Przede wszystkim zbyt często przychodzą za późno. Kiedy zadali sobie już tyle ran, że dalej nie mogą. I wtedy, faktycznie: może być tak, że nie uda się już tego posklejać. Myślę, że żyjemy w takim przyzwoleniu na bylejakość. Przytrafia nam się jeden kryzys, drugi, kolejny, a my uparcie nic z tym nie robimy. Tkwimy w mentalności, że o potrzeby emocjonalne dba się na końcu albo w ogóle. Skupiamy się na zapewnieniu sobie bytu, na karierze zawodowej i budowaniu rodziny, ale jakaś głębsza refleksja nad mechanizmami, które rządzą naszymi relacjami, schodzi na dalszy plan. W takiej sytuacji niewiedzy jak samograj powtarzamy błędy i ulegamy zachowaniu, które prowadzi np. do rozpadu więzi.  Kiedy, w pani opinii, w związku dzieje się już naprawdę źle?
Są takie sytuacje, kiedy powinna zapalić się czerwona lampka, które sygnalizują kryzys związku. To się dzieje wtedy, kiedy np. nie cieszymy się na powrót partnera z pracy. Niechętnie budzimy się przy jego boku. Nie możemy się doczekać, kiedy zniknie nam z oczu. Nie interesujemy się tym, gdzie jest i co robi. Nasze ciało również może wysyłać sygnały. Niestety, nie ma przesady w powiedzeniu: „Robi mi się niedobrze na jego widok”. To jak najbardziej może być prawda.  Wtedy rozpad jest nieuchronny?
Niekoniecznie, choć nie należy bagatelizować objawów somatycznych. Warto słuchać tego, co mówi nasze ciało i – przede wszystkim – dlaczego? Dla mnie takim papierkiem lakmusowym jest pytanie, które zadaję na początku każdej terapii. Czy kochasz swoją dziewczynę/żonę/partnerkę? Czy ona kocha jego? Niekiedy zapada cisza. Bo tej miłości już nie ma. Proste wyznanie uczucia staje się problemem. W sytuacji kompletnego wypalenia się relacji, braku uczuć – nie ma sensu niczego wskrzeszać, bo to się po prostu nie uda. Taka para najprawdopodobniej nie będzie chciała wejść w proces terapii, w którym już na początku, żeby w ogóle miała ona sens, należy zadeklarować pracę nad sobą i uświadomić sobie, jakie to jest ważne. A często zdarza się tak, że skłóceni partnerzy przyszli na spotkanie z zamiarem zmieniania tej drugiej strony oraz z głębokim przeświadczeniem, że wina leży po drugiej stronie.  Takie myślenie jest nagminne?
Tak. I bardzo niedojrzałe. Od początku tłumaczę swoim klientom, że wina jest pół na pół i każdy ponosi odpowiedzialność za swoją część, za swoje emocje i zachowania. Punktem wyjścia do dobrej terapii jest przyznanie się: to i to było niewłaściwe w moim zachowaniu wobec ciebie, w moich komunikatach i reakcjach. Chcę to zmienić, aby nasza relacja mogła się odrodzić, zmienić na lepsze. I o to lepsze staramy się w TU i TERAZ. Przypatrujemy się sobie z wnikliwością, angażujemy się w proces z pokorą. To znaczy, mamy odwagę „przyjąć na klatę” ból i poczucie zranienia tej drugiej strony. Chcemy jej wysłuchać, zrozumieć, zmienić język naszej codziennej komunikacji, skorygować repertuar naszego zachowania, które powtarzamy jak mantrę, a które jest niewłaściwe, np. obrażanie się, wybuchanie wściekłością, obrzucanie wyzwiskami, oczekiwaniami, pretensjami, niedopuszczanie do głosu, krytykowanie. Jest cała masa zachowań, które na najlepiej zapowiadający się związek działają jak trucizna. Jak sprawdzić, czy warto dalej ciągnąć swój związek?
Namawiam np. pary do wizualizacji życia bez tej drugiej osoby. Jak sobie je wyobraża? Siebie już bez bycia z nim czy z nią? Jak wyglądałaby moja codzienność? Moje marzenia i plany? Niekiedy takie przeżycie straty „na niby” uzmysławia nam, że tak naprawdę nie pragniemy rozstania, a przeszkadzają nam i uwierają do bólu pewne obszary we wspólnym byciu. One mogą dotyczyć przeróżnych sfer wspólnej egzystencji: ekonomicznej, emocjonalnej, intymnej. Trzeba zlokalizować problem, bolesne miejsce, aby móc je uzdrowić. To wymaga dużego wysiłku w postaci szczerości, dobrych intencji i zaangażowania. I potem pracy nad tym, aby krok za krokiem poprawiać, korygować i zmieniać to wszystko, co wpłynie na zmianę naszego życia w ogóle. Nie tylko tej konkretnej relacji. Zdarza się, że parom się nie udaje. Dlaczego?
Osoby z żalu, chęci udowadniania swojej racji i walki o swoją prawdę nie chcą zrezygnować z ranienia siebie nawzajem. Jest zbyt dużo wrogości i poczucia krzywdy. Nie ma tej elementarnej deklaracji dobrej woli i gotowości do zmiany. Ale ta niemożność może dotyczyć również par, w których jest przemoc, uzależnienie, jakaś patologia. Wówczas potrzebna jest najpierw terapia indywidulana. Trzeba przepracować własne traumy, często ukryte jeszcze w głębokim dzieciństwie. Niekiedy jestem zaskoczona, bo para, która świetnie rokowała na terapii, dochodzi do ściany. Okazuje się, że hamulcem okazały się bardzo osobiste sprawy z przeszłości, nad którymi, aby pójść dalej w terapii, trzeba się pochylić. I wtedy ktoś może tego zwyczajnie nie chcieć. Nie ma ochoty rozdrapywać podgojonych ran, w jakiś sposób uporał się ze swoją traumą. Tylko ten jakiś sposób jest nieskuteczny i niewystarczający. Jednak ona wciąż warunkuje jego zachowania, które ciążą na tym wszystkim, co dzieje się TU i TERAZ. Każdy proces terapeutyczny służy poprawie jakości naszego życia, które właśnie się toczy. Jednak, aby to mogło mieć miejsce, trzeba rozprawić się z „demonami” przeszłości i bardziej świadomie pracować nad swoją przyszłością. Również tą dotyczącą związku.  Zobacz też: Faceci oczekują ""królewny śnieżki"", a kobiety herosa. Jakich cech szukamy u partnera?"
