links,bodies
http://tech.wp.pl/swiat-technologii-nie-lubi-juz-szalencow-6107988399593089a,"Świat technologii nie lubi już szaleńców  Palmer Luckey nie pracuje już w Facebooku. Niewykluczone, że przez poglądy. To dobry dowód na to, że w świecie technologii nie ma miejsca dla osób, które wychodzą poza ramy. A skoro tak, to jak ktokolwiek ma stworzyć coś przełomowego?  Dlaczego nie mamy jeszcze latających aut? Dlaczego wciąż nie posiadamy kolonii na Marsie? W latach 70. i 80. filmy, a wcześniej książki science fiction, zapewniały nas, że w XXI wieku postęp technologiczny będzie tak duży, że loty w kosmos będą możliwe dla każdego, a latająca deskorolka stanie powszechnym gadżetem dzieciaków.  Jest 2017 rok, nie ma lotów na Marsa, jest za to Facebook. Co poszło nie tak?  W książce “Utopia regulaminów. O technologii, tępocie i ukrytych rozkoszach biurokracji” David Graeber stwierdza, że rozwój technologii został zahamowany przez biurokrację. Papierkowa robota, wypełnianie wniosków, pisma proszące o dofinansowanie, w końcu menedżerowie sprawdzający, czy projekt się opłaca - wszystko to sprawia, że technologia przestała być magiczna. Naukowcy i inżynierowie nie mają czasu projektować i tworzyć szalonych wizji, bo toną w dokumentach. A geniusze, którzy marzą o czymś więcej, w tym świecie po prostu się nie odnajdują. Nie ma dla nich miejsca, ważniejsza jest opinia księgowego. Gdyby Albert Einstein żył dzisiaj, nic by nie zdziałał. Oczywiście można spojrzeć na to inaczej. Latających samochodów nie ma, bo to bardzo niepraktyczne rozwiązanie. W filmach prezentowało się świetnie, ale nikt nie zająknął się nawet o skutkach ubocznych i wadach.  Ale w jednym David Graeber miał na pewno rację - to już nie jest branża dla szalonych wizjonerów.  Palmer Luckey nie jest już szefem Oculusa i pracownikiem Facebooka. Nie wiadomo, czy sam zrezygnował, czy to jemu podziękowano. Można jednak podejrzewać, że Luckey przestał być w Facebooku mile widziany.  Luckey już jako 18-latek stworzył prototyp gogli VR. Potem ze swoją wizją urządzenia do wirtualnej rzeczywistości wylądował na Kickstarterze. Uruchomiona w 2012 roku zbiórka  przyniosła twórcy 2,5 mln dolarów.  A w 2014 roku Facebook kupił firmę Luckey’a za 2 mld dolarów. I tym samym chłopak, który nie ukończył jeszcze 25 lat, stał się miliarderem. Oraz jedną z najważniejszych osób w świecie technologii.  Niewątpliwie na to zasłużył. W końcu odświeżył wirtualną rzeczywistość. To Oculus Rift zapoczątkował modę na gogle VR.  Palmer Luckey wprawdzie nie był wielkim wynalazcą. Nie odkrył niczego przełomowego. Raczej dopracował wcześniej stworzone rozwiązania, na dodatek zrobił to we właściwym czasie. To nie umniejsza jego zasług - wstrzelić się z pomysłem to duża sztuka.  Był też dowodem na piękno internetu i możliwości, jakie daje. Pasjonat, który wcześniej sam montował prototypy gogli VR, zachwycił cały świat swoim projektem. A ludzie wpłacali mu pieniądze, pozwalając zrealizować wizję. Dzięki Kickstarterowi wszystko stało się możliwe. Jednoosobowe przedsięwzięcie w krótkim czasie mogło stać się ideą, którą kupuje technologiczny gigant, taki jak Facebook.  Ale młodziutki Luckey jakoś w tym wielkim świecie się nie odnalazł. W 2016 roku wyszło na jaw, że szef Oculusa po cichu sponsorował stronę z memami, które popierały Donalda Trumpa i przy okazji wyśmiewały Hillary Clinton. To nie spodobało się wielu ludziom z branży.  Na dodatek Oculus przegrał w sądzie z firmą ZeniMax. Sąd uznał, że Palmer Luckey i jego ludzie naruszyli prawo autorskie. Czyli wykorzystali wiedzę, która należała do ZeniMaksa. Kara: pół miliarda dolarów.  Ale Luckey ucichł znacznie wcześniej. Właśnie po “aferze” z kampanią prezydencką. W mediach społecznościowych milczy od września. Jego ostatni wpis to ten z przeprosinami. Nie było go też na październikowej konferencji Oculusa. Został odstawiony na boczny tor.  Czy rzeczywiście ciche wspieranie kontrowersyjnego kandydata jest aż tak wielkim przewinieniem? Jak widać w świecie wielkich technologicznych korporacji - tak.  Palmer Luckey nie jest nieprzewidywalnym szaleńcem. Nie nawoływał wprost do głosowania na Trumpa, nie szokował swoimi poglądami, nikogo nie obrażał. Możemy wyobrazić sobie bardziej niewygodnych współpracowników. A mimo to Facebook i tak wolał nie mieć z nim nic wspólnego.  Nie można też powiedzieć, że Luckey był jakoś wyjątkowo szalony. Był jednak inny. Wyróżniał się. Spójrzcie na uroczą okładkę magazynu Time:  Albo fakt, że pierwszy komercyjny egzemplarz Oculus Rift dostarczył klientowi sam, ubrany w koszulkę rodem ze sklepu Wojciecha Cejrowskiego. Jest w nim coś nieszablonowego.  To jednak nie wpisuje się w standardy gigantów świata technologii. Znamienne. Za to nie brakuje przewidywalnych ""nudziarzy"". Wiemy, że wyjdą na konferencję w tym samym stroju (jak Zuckerberg czy wcześniej Jobs), wiemy, co powiedzą, wiemy, co pokażą - kolejną udoskonaloną wersję tego samego produktu.  Jasne, Mark Zuckerberg przewiduje trendy i je kreuje - gdy kupował Oculusa, wielu było zdziwionych tą decyzją. A on już wtedy miał plany, jak wykorzystać VR do swoich społecznościowych celów i teraz konsekwentnie je realizuje. Mark Zuckerberg ostatnio pracował też nad stworzeniem sztucznej inteligencji, która będzie zarządzała jego domem. System mówi głosem Morgana Freemana. Imponujące projekty są jednak raczej ukryte, ewentualnie pokazywane jako ciekawostka. Facebook jest cierpliwy, wyrachowany. A co za tym idzie - niezbyt magiczny. Niczym nas nie zaskoczy, nie będzie spontaniczny. Poczeka na właściwy moment.  Oczywiście branża technologiczna ma jednego prawdziwego “wariata” - Elona Muska. To wizjoner, który wprowadza w życie niesamowite idee. Superszybka kolej, podbój kosmosu, autonomiczne samochody, podziemne tunele mające wyeliminować korki - lista szalonych pomysłów jest długa.  Przywykliśmy nazywać Muska “szalonym”, “ekscentrycznym”, “nieobliczalnym”. Ale czy naprawdę robi aż tak nieprawdopodobne rzeczy? Przecież właśnie tego dawniej spodziewano się po XXI wieku: podboju kosmosu czy niezwykle mądrej sztucznej inteligencji. Musk jako jedyny stara się do tego nawiązać. I ruszyć z miejsca.  A przecież nie brakuje reakcji - to niemożliwe, to się nie uda, Musk to hochsztapler.  Może właśnie dlatego trudno w jego pomysły uwierzyć - bo brakuje liderów i wizjonerów z prawdziwego zdarzenia, którzy w magiczny sposób ""sprzedają"" swoje wizje."
http://tech.wp.pl/jak-neil-armstrong-oszukal-smierc-6107037518935681a,"Jak Neil Armstrong oszukał śmierć Lądowanie na Księżycu poprzedzone było wieloletnimi przygotowaniami. W takcie jednej z prób astronauci Neil Armstrong i David Scott mieli zacumować na orbicie do członu rakiety nośnej. Ale nie wszystko poszło zgodnie z planem. W marcu 1966 roku trwały próby do lądowania na Księżycu. Wstępem do niego było wystrzelenie w kosmos statku Gemini 8 z dwoma astronautami na pokładzie i rakiety Agena. W ramach próbnych manewrów załoga statku miała na orbicie zacumować do członu rakiety nośnej. Dokowanie było udane - doszło do niego już 6,5 godziny po starcie Gemini 8. Ale zadowolenie NASA trwało zaledwie 30 minut. Astronauci Neil Armstrong i David Scott aż trzy razy próbowali użyć silników kapsuły, żeby znaleźć się na tej samej orbicie, co rakieta. Bezskutecznie.  Początkowo wszystko szło zgodnie z planem i radar Gemini 8 wychwycił Agenę, gdy statek był od oddalony o 332 km. Po kolejnych manewrach Neil Armstron ręcznie dokonał dokowania. Po raz pierwszy w historii udało się połączyć dwa statki kosmiczne na orbicie. Szczęście astronautów i całego NASA trwało jednak tylko 30 minut, po których zestaw Gemini i Ageny zaczął się niespodziewanie obracać. Połączone statki wirowały na orbicie, a paliwa w zbiornikach było coraz mniej. Astronauci doszli do wniosku, że najlepszym rozwiązaniem będzie odłączenie się od rakiety. Gdy tylko to zrobili, statek Gemini 8 zaczął obracać się jeszcze szybciej, Scott i Armstrong byli bliscy utraty świadomości, a decyzję trzeba było podejmować natychmiast.  Dramatyczną sytuację udało się opanować. Wyłączono orbitalny system sterowania, włączono silniki systemu sterowania przy wchodzeniu w atmosferę. Gemini 8 w końcu udało się ustabilizować. 10 godzin po starcie astronauci wodowali bezpiecznie na Pacyfiku. Gdyby nie to, że Armstrong miał już doświadczenie w pilotowaniu samolotu rakietowego, to nie wiadomo, jak skończyłaby się ta misja."
http://tech.wp.pl/13-powodow-dla-ktorych-polska-powinna-zaczac-inwestowac-w-kosmiczne-gornictwo-6106993376609921a,"13 powodów, dla których Polska powinna zacząć inwestować w kosmiczne górnictwo Polskie firmy utworzyły konsorcjum EX-PL, którego celem będzie tworzenie technologii umożliwiających prowadzenie m.in. pierwszych misji wydobywczych w kosmosie. Brzmi nieprawdopodobnie? To krok w dobrą stronę - wyjaśniamy, dlaczego Polska powinna inwestować w kosmiczne górnictwo.  W skład konsorcjum EX-PL weszły firmy specjalizujące się w robotyce kosmicznej, obserwacjach planetoid i integracji systemów kosmicznych: ABM Space, Cilium Engineering, Creotech Instruments S.A. i Sybilla Technologies. Dlaczego to ważne i dlaczego ta inwestycja nam się zwróci?  Eksploracja kosmosu brzmi trochę jak scenariusz filmu SF. Ale pozyskiwanie surowców z kosmosu wcale nie jest wymysłem scenarzystów czy pisarzy, który zrealizuje się w czasach, których my nie dożyjemy. NASA do 2025 roku planuje załogowe lądowanie na planetoidzie. Prywatne przedsiębiorstwa też już działają.  - Planetary Resources chce się specjalizować w pozyskiwaniu kosmicznej platyny. Plan firmy zakłada budowę orbitalnych teleskopów, które z dużym wyprzedzeniem wykrywałyby asteroidy i pozwalały na analizę ich składu. W przypadku potwierdzenia złóż platyny w stronę asteroidy wyruszałyby statki kosmiczne, których zadaniem byłoby jej przechwycenie.(...) Inna firma, Deep Space Industries, chce zająć się umieszczaniem na orbicie fabryk, zajmujących się przetwarzaniem i pozyskiwaniem kosmicznych surowców - pisał Łukasz Michalik z Gadżetomanii.  W kosmosie mnóstwo jest surowców, których na Ziemi nie ma wcale lub występują w śladowych ilościach. Chodzi tu o platynę i wolfram, iryd, osm, pallad, ren, rod czy ruten. Jest też jeden z izotopów helu (hel-3), którego “na miejscu” mamy niewiele. A może stać się niezwykle wydajnym, a przy tym ekologicznym źródłem taniej energii. A to za sprawą takich firm jak SpaceX. Dzięki nim do 2025 roku koszt wyniesienia tony ładunku na orbitę ma spaść do około 200 tys. dolarów, co sprawi, że eksploatacja surowców w kosmosie po prostu będzie się opłacać. Eric Anderson, współzałożyciel Planetary Resources szacował, że koszt pozyskania z asteroidy uncji platyny wyniesie około 300 dolarów. Cena uncji platyny pozyskiwanej z ziemskich zasobów to około 1300 dolarów. - Doprowadzenie do opłacalności wydobycia górniczego z planetoid pochłonie kwoty rzędu miliardów dolarów - mówi mi dr Grzegorz Brona, prezes Creotech Instruments S.A. - Ale na szczęście inwestycje te będą rozłożone na dziesiątki lat i zapewne będą łączyć wysiłki wielu państw i dużych prywatnych korporacji. Jako konsorcjum chcemy dostarczyć pewnych technologii dla tych odległych misji. Nie planujemy być podmiotem, który zajmuje się wydobyciem jako takim. Można powiedzieć, że część z tych gargantuicznych pieniędzy pokryje faktury, które wystawimy w zamian za zakup opracowanych technologii. Obecnie mamy pomysł na rozwój kilku takich technologii, których koszt wytworzenia szacujemy na kilkadziesiąt milionów złotych. Jednak planujemy technologie te wdrożyć również w innych obszarach gospodarki, aby w oczekiwaniu na pierwsze misje wydobywcze koszt procesu opracowania zwrócił nam się wielokrotnie. ""Każde euro zainwestowane w kosmos - można powiedzieć - wraca na Ziemię"" - stwierdził wicepremier Mateusz Morawiecki.  - W Polsce robotyka kosmiczna rozwija się bardzo prężnie jako jedna ze specjalizacji. (...) Polskie firmy ustawiły się w bardzo dogodnej pozycji w wyścigu po przyszłe zasoby, mające strategiczne znaczenie dla naszego kraju. Zajęliśmy świetną niszę w kosmicznej branży, która nie jest jeszcze wypełniona przez międzynarodowych gigantów - mówił w rozmowie z PAP Mateusz Józefowicz z firmy ABM Space stojącej na czele konsorcjum, którego zdaniem jest “tworzenie technologii umożliwiających prowadzenie m.in. pierwszych misji wydobywczych w kosmosie”.  Szkoda by było zmarnować przewagę, którą sobie wypracowaliśmy. - Mały bywa szybszy - mówi mi Mateusz Józefowicz, współzałożyciel ABM Space. - Zamieniamy nasze słabości (czyli lata opóźnień w rozwoju w branży kosmicznej) w siłę (czyli możliwość elastycznego dostosowania strategii). Firmy z Polski nadal szukają swoich nisz i nie mają strategicznych planów zakontraktowanych na dekady. Dzięki temu łatwiej jest wykonać skok nad głowami gigantów tam, gdzie firmy głównego nurtu na razie widzą większe ryzyko (ale trzeba się spieszyć, bo zorientują się bardzo szybko). Orbita okołoziemska jest zatłoczona przez konkurencję, a my przyłączamy się do trendu wyniesienia przemysłu także dalej, w głęboką przestrzeń. Luksemburg buduje platformę prawną dla społeczności międzynarodowej. Według niej, wszystko, co się wydobędzie i przyjmie na pokład pojazdu kosmicznego, należy do pozyskującego. Nawet jeśli będziemy tylko z kimś współpracować, to i tak możemy wiele wywalczyć dla siebie.  - Obecnie nie jesteśmy pod tym względem niezależni. Ale już niedługo może się to zmienić, zważywszy na coraz większą dostępność taniejących środków wynoszenia misji na orbitę - stwierdza Mateusz Józefowicz. - To nie jest tylko kwestia środków, które o wiele łatwiej będzie zgromadzić na rzecz misji eksploatacyjnej (konkretny ekonomiczny cel) niż na rzecz misji czysto naukowej, jak dotychczas. To jest także czas potrzebny na osiągnięcie konkretnych planetoid, ponieważ okna i trajektorie wymagają tutaj sporej cierpliwości. Współpraca międzynarodowa znacznie zwiększa szansę na sukces projektu, podobnie jak ma to miejsce w przypadku dużych inwestycji górniczych na Ziemi. Poszczególne kraje czy organizacje mogą tu uzupełniać się kompetencjami, dzięki czemu nie wyważa się otwartych drzwi. A zasobów starczy dla wszystkich, z nawiązką. - Liczymy jednak głównie na to, że po stronie polskiej znajdą się odpowiednie organizacje, fundusze i wola, żeby rozpocząć intensywne przygotowania. Trzeba się trochę obudzić, abyśmy uniknęli sytuacji jak z rakietami Meteor, gdy w wyniku decyzji obcego mocarstwa byliśmy zmuszeni porzucić program rakietowy, przez co dzisiaj nie mamy własnych środków wynoszenia i musimy ustawiać się jako petent w kolejce i płacić wielkie pieniądze za miejsce na rakiecie. Dzisiaj nikt nam niczego nie dyktuje, więc jeśli powtórzymy taką wpadkę tym razem z własnej woli, będzie to bardzo przykre i nasze dzieci nam to wypomną - ostrzega Józefowicz.  Eksploracja kosmosu w naszym wykonaniu może wydawać się materiałem na anegdotę, ale… takie myślenie to błąd.  - Polskie jednostki naukowo-badawcze i uczelnie wyższe mają wieloletnie doświadczenie w działalności kosmicznej i spore osiągnięcia w tej dziedzinie, zwłaszcza w budowie instrumentów badawczych na misje kosmiczne i elementów do satelitów oraz w przetwarzaniu uzyskiwanych z kosmosu danych - zauważyło Ministerstwo Rozwoju.  - Polskie firmy dysponują pakietem dość wyspecjalizowanych narzędzi, które dotąd były stosowane w programach naukowych i badawczo-rozwojowych. Są to sprawdzone już w kosmosie systemy do próbkowania planetoid, systemy obserwacji i analizy planetoid, wyspecjalizowane narzędzia optyczne czy też systemy do lądowania na ciałach o niskiej grawitacji (pamiętamy lądownik Phileae – odbił się trzy razy, nasze się nie odbijają). Pomaga też ogólne nastawienie – zarówno rząd Luksemburga, jak i jego doradcy, tacy jak Simon P. Worden, dyrektor Breakthrough Foundation i były szef NASA Ames Research Center w Dolinie Krzemowej, widzą naszą determinację i entuzjazm, a także nasze zrozumienie dla tej historycznej potrzeby. To także spora część naszego kapitału, tym bardziej, że oni sami myślą całkowicie wizjonersko, nietuzinkowo i jak na organizacje publiczne – wyjątkowo. Chciałbym, żeby ta wizja zaraziła także więcej ludzi po polskiej stronie - mówi w rozmowie z WP Tech Mateusz Józefowicz, współzałożyciel ABM Space.  W Polsce działa kilkaset firm wytwarzających technologie kosmiczne.  - Według resortu od momentu przystąpienia Polski do Europejskiej Agencji Kosmicznej w 2012 r. polski przemysł kosmiczny zaczął dynamicznie się rozwijać. W chwili akcesji Polski do ESA na specjalnym portalu internetowym agencji zarejestrowanych było poniżej 50 polskich podmiotów zainteresowanych udziałem w przetargach agencji, a obecnie jest ich ponad 300. W większości są to małe i średnie przedsiębiorstwa, dla których działalność kosmiczna stanowi coraz ważniejszy obszar aktywności - pisał money.pl.  - Dzięki sektorowi kosmicznemu do gospodarki w ciągu ostatnich czterech lat wpłynęło ok. 200 mln zł - powiedziała w grudniu ubiegłego roku Marta Wachowicz z Polskiej Agencji Kosmicznej. - Aktywnie na rynku działa już ok. 50 firm, które są podwykonawcami w dużych projektach europejskich - dodała.  Kosmiczne górnictwo to znacznie większe pieniądze, więc warto byłoby pójść za ciosem.  I mowa tu nie tylko o tym, że inwestycja się zwróci. Kosmiczne technologie przydadzą się też na Ziemi, o czym w rozmowie ze mną wspomina dr Grzegorz Brony:  - Wybór konkretnych technologii do opracowania nie może bazować tylko i wyłącznie na zapotrzebowaniu przyszłego kosmicznego przemysłu wydobywczego. Musimy patrzeć szerzej i zastanowić się, jakie technologie, które opracowane są pod kątem przemysłu wydobywczego, mogą znaleźć swoje zastosowania w innych obszarach - kosmicznych i ziemskich. To właśnie ten „niewydobywczy"" obszar pozwoli domknąć biznesowo projekt i da szansę na wygenerowanie zysków w perspektywie znacząco krótszej niż kilka dziesięcioleci. Polska jest tutaj na uprzywilejowanej pozycji, bo od lat rozwija szereg takich technologii. Są to m.in. przetwarzanie danych satelitarnych, obserwacje ciał niebieskich, które niosą za sobą potencjał ich wykorzystania jako źródło przyszłego ""urobku"", konstrukcja specjalnych narzędzi: wierteł i młotów używanych w misjach kosmicznych czy robotyka kosmiczna. Wpisanie tych technologii w dziedzinę górnictwa kosmicznego i dzięki temu skoordynowanie i wsparcie ich rozwoju pozwoli na ich szybsze ulepszanie i wdrażanie już teraz, a w perspektywie 40 lat da istotną przewagę technologiczną na globalnym rynku kosmicznego przemysłu wydobywczego. Logiczne - wydobywanie surowców w Kosmosie oznacza, że Ziemię zostawiamy w spokoju. Przestajemy w niej kopać i ją niszczyć, skoro bardziej opłaca się pozyskiwać surowce z Kosmosu."
http://tech.wp.pl/szalony-pomysl-microsoftu-gigant-chce-zatopic-serwery-6107007142000257a,"Szalony pomysł Microsoftu. Gigant chce… zatopić serwery  Serwery zużywają mnóstwo prądu. Jak z tym problemem sobie poradzić? Naukowcy pracujący dla Microsoftu mają bardzo nietypowy pomysł. Albo przejdą do historii jako geniusze, albo będą bohaterami niejednego żartu.  Microsoft chce, żeby serwery znalazły się... pod wodą. Dlaczego? Centra danych zużywają mnóstwo prądu. Na przykład w 2015 roku wykorzystały około 70 mld kWh. Ta ilość energii odpowiada około 40 proc. rocznej produkcji w Polsce - zauważa portal wysokienapiecie.pl.  Prąd potrzebny jest nie tylko do działania, ale i chłodzenia serwerów. Dodajmy, że coraz więcej usług działa w chmurze, więc centra danych będą się tylko rozrastać. Zużycie więc wzrośnie, a nie spadnie. Na dodatek potrzebne jest miejsce, w którym trzymane są serwery.  No, chyba że pomysł naukowców z Microsoftu się sprawdzi. Jak takie podwodne centrum danych miałoby wyglądać i działać?  Składałoby się ono z wielkich stalowych cylindrów – w każdym można byłoby umieścić po kilka tysięcy serwerów. Całość byłaby ustawiona w odległości 1-3 km od brzegu w miejscach, gdzie morze ma głębokość od 50 do 200 m – pisze portal wysokienapiecie.pl.  Pomysł wydaje się szalony, ale przy tym zaskakująco logiczny. Przynajmniej w teorii. Pomysłodawcy – Sean James i Todd Rawlings – zwracają uwagę na to, że połowa ludności świata żyje nie dalej niż 100 km od morza. Bliskość serwerów pozwalałaby skuteczniej “rozładować” ruch w sieci i zapewnić lepsze działanie internetu.  A przy tym to olbrzymie oszczędności. Prąd brałoby się z ulokowanych na morzu elektrowni wodnych. Zużycie byłoby znacznie mniejsze, ponieważ serwery chłodziłyby się naturalnie. W końcu znajdowałyby się pod wodą.  Rewolucyjny pomysł już sprawdzono. Platforma testowa, w której znalazły się komputery, zanurkowała w Pacyfiku u brzegów Kalifornii. Projekt zdał egzamin, choć zauważono pewne niedociągnięcia: – Nie spodziewaliśmy się tylko, że nowy, nieruchomy obiekt na dnie tak szybko przyciągnie mieszkańców mórz. Błyskawicznie pokrył się warstewką mikroorganizmów, w ślad za którymi pojawiły się zwierzęta. Naszą serwerownię polubiły ryby i kraby. Byliśmy tym zachwyceni, ale z drugiej strony zaczęliśmy się obawiać o sprawność systemu wymiany ciepła między kapsułą a jej morskim otoczeniem. Teraz musimy więc dokonać takich zmian w projekcie, aby pogodzić potrzeby natury z potrzebami komputerów – powiedział Sean James.  Kolejne próby odbędą się w jeszcze w 2017 roku. Nawet jeśli nowe rozwiązania okażą się skuteczne, to nie zakończy to testów. Twórcy chcą, by serwery “na próbę” zanurzone były co najmniej przez pięć lat. Jeszcze więc trochę czasu minie, nim pomysł Microsoftu stanie się powszechny."
