links,bodies
http://teleshow.wp.pl/jaroslaw-kret-wciaz-przezywa-rozstanie-z-telewizja-polska-zabraniam-ogladac-przy-mnie-tvp-6109389399115905a,"Jarosław Kret wciąż przeżywa rozstanie z Telewizją Polską. ""Zabraniam oglądać przy mnie TVP"" Pogodynek udzielił kolejnego wywiadu, w którym w ostrych słowach rozprawia się ze swoim byłym pracodawcą. Choć Jarosław Kret został zwolniony z Telewizji Polskiej niemal rok temu, wciąż przeżywa rozstanie ze stacją. Pogodynek nie ukrywa, że nie ma najlepszego zdania o tym, w jaki sposób się z nim rozstano i co się dzieje za kulisami u publicznego nadawcy. Wielokrotnie w wywiadach podsumowywał zmiany, jakie zostały dokonane w TVP i nie szczędził w tym podsumowaniu gorzkich słów. Ostatnio znów udzielił wywiadu, w którym ostro skomentował to, co dzieje się przy Woronicza i podzielił się swoimi refleksjami na temat byłego pracodawcy. - Jeżeli ktoś włącza przy mnie TVP i ma ochotę ją oglądać, to ja wychodzę. Zabraniam oglądać przy mnie TVP. Pozostaje niesmak i w moim domu tej stacji się nie ogląda. Na szczęście pojawił się program TVN ""Agent - Gwiazdy"" i pozwolił mi zmyć ten radioaktywny pył, który nosiłem na sobie po ostatnich miesiącach pracy w TVP. One naprawdę mnie skaziły. Bogu dzięki, że zostałem wyrzucony, gdy pewnego dnia mnie do TVP nie wpuszczono. Odpocząłem, napisałem książkę, wyjechałem na wakacje z synem i ruszyłem na gigantyczne ""agentowe"" przeżycie - podsumował na łamach ""Faktu"".  Tutaj sprawdzisz aktualną ramówkę Telewizji WP  Tu pobierzesz za darmo aplikację Program TV:"
http://teleshow.wp.pl/agata-bialy-cholewinska-nowa-prowadzaca-teleexpress-jej-nazwisko-brzmi-znajomo-to-nie-przypadek-6109374592886913a,"Agata Biały-Cholewińska nową prowadzącą ""Teleexpress"". Jej nazwisko brzmi znajomo? To nie przypadek Od tej pory ""Teleexpress"" poprowadzi małżeństwo. Dobra zmiana? 6 kwietnia br. w roli prowadzącej ""Teleexpress"" i ""Teleexpress Extra"" zadebiutowała Agata Biały-Cholewińska. Jeśli wydaje wam się, że jej nazwisko brzmi znajomo, nie mylicie się. W 2010 roku dziennikarka wyszła za mąż za Michała Cholewińskiego - obecnego prowadzącego ""Teleexpress"".  Tuż po ślubie zniknęła z anteny, poświęcając się macierzyństwu. W czerwcu 2011 roku Cholewińscy doczekali się syna Jasia. Na początku 2012 roku wróciła do pracy, ale nie na długo. Wiosną 2014 roku przeszła do TVP Info, choć jej transfer nie był takim zaskoczeniem, jak fakt, że kilka miesięcy później w jej ślady poszedł mąż. Prezenterka od trzech lat związana jest z TVP - początkowo pracowała w stacji jako reporterka, a później została gospodynią serwisów informacyjnych w porannym paśmie. Wcześniej była pracownikiem TVN CNBC (obecnie TVN24 BiS).  Tutaj sprawdzisz aktualną ramówkę Telewizji WP  Tu pobierzesz za darmo aplikację Program TV:"
http://teleshow.wp.pl/teleexpress-traci-widzow-wszystko-przez-odejscie-macieja-orlosia-6108747681592961a,"""Teleexpress"" traci widzów. Wszystko przez odejście Macieja Orłosia? Największy spadek oglądalności dotknął ""Teleexpress"". Czyżby widzowie wciąż nie mogli pogodzić się z odejściem Macieja Orłosia? Jak wynika z badań Nielsen Audience Measurement, liderem oglądalności wśród serwisów informacyjnych w marcu br. zostały ""Fakty"" (3,09 mln widzów). Magazyn prowadzony m.in. przez Justynę Pochanke i Grzegorza Kajdanowicza stracił jednak 227 tys. oglądających w porównaniu do ubiegłego roku.  Druga lokata należy do ""Wiadomości"" (2,89 mln). Trudno jednak mówić o sukcesie TVP1, bowiem oglądalność zmalała aż o 305 tys. osób. W przedziale wiekowym 16-49 lat to właśnie program informacyjny Jedynki odnotował największy spadek - do 659 tys. widzów. Na trzecim miejscu uplasował się ""Teleexpress"", którego redakcja również nie ma powodu do świętowania. Według danych Nielsen Audience Measurement program oglądało 2,87 mln osób - to słabszy wynik aż o 607 tys. W rezultacie widownia właśnie tego dziennika zmniejszyła się najbardziej w całym zestawieniu. Czyżby widzowie nie pogodzili się jeszcze z odejściem głównego gospodarza - Macieja Orłosia? Wiele na to wskazuje. Wystarczy wspomnieć, że ""Teleexpress"" od zawsze był jednym z najbardziej lubianych i najchętniej oglądanych magazynów informacyjnych w Polsce. Pierwsze spadki serwis odnotował właśnie po przejściu Orłosia do Telewizji WP.  Tutaj sprawdzisz aktualną ramówkę Telewizji WP  Tu pobierzesz za darmo aplikację Program TV:"
http://teleshow.wp.pl/piotr-tymochowicz-szykuje-sie-do-slubu-jego-zona-zostanie-20-letnia-kambodzanka-6108379263178881a,"Piotr Tymochowicz szykuje się do ślubu. Jego żoną zostanie 20-letnia Kambodżanka Piotr Tymochowicz wkrótce stanie na ślubnym kobiercu. Wybranką serca polskiego eksperta od spraw wizerunku politycznego jest młodsza od niego o 34 lata Kambodżanka. ""To miłość od pierwszego wejrzenia"" - wyznaje Tymochowicz. Para spisała już umowę przedmałżeńską. Piotr Tymochowicz musiał się udać aż do dalekiej Azji, by odnaleźć miłość swojego życia. W Kambodży poznał 20-letnią Sa Na, która od razu zawróciła mu w głowie.  - To się nazywa miłość od pierwszego wejrzenia. Szliśmy w swoim kierunku i w pewnym momencie stanęliśmy naprzeciwko siebie. Staliśmy tak z 20 sekund i patrzyliśmy na siebie, po czym wziąłem ją za rękę i poszliśmy dalej. I tak się zaczęło - zdradza Tymochowicz w rozmowie z ""Super Expressem"". Dodaje, że już 12 kwietnia br. weźmie on ślub ze swoją nową ukochaną. Tymochowicz ma już za sobą jedno małżeństwo. Niespełna dwa lata temu rozwiódł się on z Marzeną Popowską. Wydaje się, że u boku nowej partnerki odnalazł spokój i szczęście: - Kocham ją. Uczę Sa Na języka angielskiego, a ona mnie języka khmerskiego. Chcemy zamieszkać w Kambodży, a po kilku latach przenieść się do Tajlandii albo Malezji. To Sa Na nauczyła mnie, co to znaczy żyć tu i teraz, a nie przeszłością czy przyszłością. Tymochowicz zdradził, jaki pierścionek zaręczynowy wręczył ukochanej: - Mamy już umowę przedmałżeńską. Sa Na dostała od mnie piękny pierścionek, wart około 1000 dolarów. Kochamy się i chcemy spędzić ze sobą życie. Ekspert chwali się swoim szczęściem za pośrednictwem mediów społecznościowych, gdzie często zamieszcza zdjęcia swojej nowej wybranki serca. Czy młoda Kambodżanka i Tymochowicz pasują do siebie? Piotr Tymochowicz to urodzony w 1963 roku polski doradca medialny i specjalista do spraw wizerunku oraz marketingu politycznego. W latach 90. pomagał m.in. Marianowi Krzaklewskiemu, a  przed wyborami parlamentarnymi w roku 2001 wykreował nowy image Andrzeja Leppera. Metody pracy Tymochowicza można było zobaczyć w dokumencie Marcela Łozińskiego ""Jak to się robi?"", gdzie ukazane zostały mechanizmy tworzenia medialnej postaci z tzw. szarego obywatela.  Tutaj sprawdzisz aktualną ramówkę Telewizji WP  Tu pobierzesz za darmo aplikację Program TV:"
http://teleshow.wp.pl/stacja-fox-news-zaplacila-za-milczenie-kobiet-molestowanych-przez-billa-oreilly-6108044292049025a,"Stacja Fox News zapłaciła za milczenie kobiet molestowanych przez Billa O’Reilly Dziennikarze ""New York Times"" dotarli do mrocznych faktów z życia 67-letniego dziennikarza i komentatora, gospodarza nadawanego przez Fox News Channel programu ""The O’Reilly Factor"". Według gazety na przestrzeni lat stacja musiała walczyć o zachowanie dobrego wizerunku Billa O’Reilly, który wielokrotnie miał się dopuścić molestowania kobiet zatrudnionych przy jego programie. ""New York Times"" ustaliło, że Fox News zawarł ugody z pięcioma ofiarami ataków ze strony prezentera. Wśród nich były dziennikarki, pracownice newsroomu oraz jedna z producentek ""The O’Reilly Factor"". Według zeznań kobiet O’Reilly miał wprost sugerować im ułatwienia w karierze w zamian za usługi seksualne, często komentować w obraźliwy sposób ich wygląd i zachowywać się obscenicznie w trakcie prowadzonych rozmów telefonicznych.  Stacji bardziej opłacało się zapłacić za milczenie molestowanych kobiet niż narażać na szwank wizerunek znanego komentatora, którego program przynosi miliardy dolarów przychodów. Okazuje się, że na wszystkie odszkodowania wydali kwotę 13 mln dol. Na pytania dziennikarzy o wiarygodność doniesień kanał Fox News odpowiedział oświadczeniem, w którym zaznaczono, że stacja bardzo poważnie traktuje kwestię warunków pracy. Komunikat sugeruje, że Bill O’Reilly przyznał się do pewnych nieprawidłowości w swoim zachowaniu (ale nie wprost do molestowania) i obiecał ściśle współpracować z nadawcą w utrzymaniu odpowiednich standardów w relacjach ze współpracownikami.  Warto przypomnieć, że to nie jedyna afera związana z molestowaniem pracownic tej stacji. W 2016 roku wybuchł skandal dotyczący oskarżeń o seksualną agresję Rogera Ailesa, szefa Fox News. W rezultacie mężczyzna stracił stanowisko i odszedł ze stacji, zaś jego ofiarom wypłacono wysokie rekompensaty finansowe.  Tutaj sprawdzisz aktualną ramówkę Telewizji WP  Tu pobierzesz za darmo aplikację Program TV:"
http://teleshow.wp.pl/tvp-znow-manipuluje-internauci-wylapali-kilka-niescislosci-6108006815619201a,"TVP znów manipuluje? Internauci wyłapali kilka nieścisłości ""Wiadomości"" znów w ogniu krytyki. Tym razem za materiał na temat ataku hakerów na polskie banki. Telewizja Polska znów stała się pożywką dla mediów i internautów. Wszystko przez jeden z materiałów, który ukazał się w ""Wiadomościach"". Sprawa dotyczyła ataku hakerów na polskie banki (tutaj przeczytacie więcej na ten temat). Jak usłyszeli w zapowiedzi widzowie:  - Północnokoreański reżim mógł stać za atakiem hakerskim na polski system bankowy, do którego doszło w ubiegłym miesiącu. Sugerują to dziennikarze New York Timesa. Według nich, Korea Północna dysponuje jedną z najlepszych armii hakerów na świecie. Atak na Polskę nie powiódł się i został błyskawicznie wykryty. Jego autorów szukają ABW i prokuratura.  Ci, którzy bacznie obserwują to, co dzieje się na finansowym świecie, od razu wychwycili pewne nieprawidłowości. Jak zauważyła Zaufana Trzecia Strona, stwierdzenie ""Atak na Polskę nie powiódł się"" ma niewiele wspólnego z rzeczywistością. Otóż wystarczy wspomnieć, że z co najmniej jednego banku zostały wykradzione dane (kilka gigabajtów informacji), a sukcesem tego nazwać nie można.  Druga, poruszona przez Zaufaną Trzecią Stronę, kwestia dotyczy stwierdzenia, że ""atak został błyskawicznie wykryty"". To również jest nadużycie, bowiem pierwsze sygnały na temat działalności hakerów pojawiły się już... pół roku temu. Sprawa ciągnęła się od października 2016 roku, a dopiero w lutym została ujawniona i zrobiło się o niej głośno. Warto również dodać, że informacja zawarta w zdaniu ""autorów ataku szukają ABW i prokuratura"" również jest mocno nieaktualna. Na koniec internauci zauważyli też, że materiał ""Wiadomości"" rozpoczął się kadrem z propagandowego wydania programu informacyjnego z... Korei Północnej, który miał obrazować atak tamtejszych hakerów. Przypadek?  Tutaj sprawdzisz aktualną ramówkę Telewizji WP  Tu pobierzesz za darmo aplikację Program TV:"
http://teleshow.wp.pl/ponad-12-tysiecy-takich-samych-petycji-w-sprawie-tvn-u-i-tvn24-trafilo-do-krrit-6107294216333441a,"Ponad 12 tysięcy takich samych petycji w sprawie TVN-u i TVN24 trafiło do KRRiT!  Autorzy identycznych petycji żądali cofnięcia koncesji obu kanałom. Czyżby widzowie konkurencyjnych stacji szykowali bojkot?  - Jednobrzmiące petycje zawierały odniesienia do materiałów prasowych opublikowanych w latach 2010-2016 na portalach internetowych, których autorzy wskazywali na przypadki nierzetelnych informacji podawanych na antenie programów TVN i TVN24 - opisała Krajowa Rada Radiofonii i Telewizji w swoim sprawozdaniu, które zacytowały Wirtualne Media. Petycja została stworzona przez użytkownika serwisu citizengo.org i do tej pory podpisana przez ponad 35 tysięcy osób. W treści znaleźć można przykłady fałszowania rzeczywistości, czyli linki do artykułów, w których powoływano się na ""Fakty"" lub inne programy TVN-u. Sama petycja brzmiała tak (pisownia oryginalna): Zwracam się do KRRiT o odebranie koncesji telewizyjnej stacji informacyjnej TVN24 jak również stacji TVN w związku z ich kłamliwymi i zmanipulowanymi przekazami zawartymi w programach informacyjnych, takich jak min. „Fakty TVN”. Programy informacyjne telewizji TVN są zmanipulowane, wprowadzają widza w błąd, niejednokrotnie podawane są w nich jako fakty zdarzenia zmyślone, nie mające nic wspólnego z rzeczywistością, wiele niewygodnych dla poprzedniej ekipy rządzącej a obecnej opozycji faktów i zdarzeń jest przemilczanych. Najgorszym jest jednak zjawisko szczucia przeciw sobie grup Polaków, które – wobec wyzwań stojących przed współczesną Europą – rozbija naszą narodową jedność. (...) W mojej ocenie, w chwili obecnej, Polakom potrzebna jest przede wszystkim rzetelna informacja. Informacja a nie opinia przemycona w podawaniu faktu, wsparta pogardliwym tonem głosu czy niewybredną mimiką, które to elementy przekazu mają kluczowe znaczenie dla przekazu telewizyjnego. Przykładów, w których członkowie polskich rodzin czy poszczególnych grup społecznych skaczą sobie wręcz do gardeł, bo „w TVN mówili” jest aż nadto i oceniam to zjawisko jako bardzo groźne dla polskiej racji stanu i dla polskiego, dość już podzielonego i zmanipulowanego przez media społeczeństwa. Być może manifest zakończył się sukcesem. Od jakiegoś czasu bowiem KRRiT uważniej przygląda się treściom nadawanym przez TVN i TVN24.  Jak czytamy na stronie Wirtualnych Mediów, w październiku 2016 roku rada podjęła postępowanie w sprawie pomyłki, do której doszło po premierze filmu „Smoleńsk” - wypowiedź innej osoby w programie TVN24 przypisano pilotowi Arturowi Wosztylowi. W lutym 2017 roku na wniosek posłanki Krystyny Pawłowicz przyjrzano się materiałom emitowanym w ""Faktach"" - oceniono, że podsycają one społeczne napięcia. W marcu 2017 roku KRRiT stwierdziła, że w reportażu w programie ""Czarno na białym"" traktującym o katastrofie smoleńskiej dziennikarze nie dochowali należytej staranności przy zbieraniu i wykorzystywaniu materiałów. Co wy sądzicie o ""Faktach""? Według sondaży to właśnie program informacyjny stacji TVN jest najchętniej oglądany przez polskich telewidzów.  Tutaj znajdziesz aktualny program tv! Tu pobierzesz za darmo aplikację Program TV:"
http://teleshow.wp.pl/jan-pietrzak-wraca-do-tvp-stacja-zapomniala-juz-o-ostatniej-aferze-z-udzialem-satyryka-6106925189740161a,"Jan Pietrzak wraca do TVP. Stacja zapomniała już o ostatniej aferze z udziałem satyryka? Telewizja Polska niczego się nie nauczyła? Kilka miesięcy temu KRRiT upomniała stację za retransmisję w TVP Kultura występu Jana Pietrzaka. Teraz TVP1 wyemituje cały cykl programów satyryka. Już 2 kwietnia (niedziela) o godz. 17.30 TVP1 zaprezentuje premierową odsłonę 10-odcinkowego cyklu ""Pół wieku Kabaretu pod Egidą"". Program powstał z okazji przypadającego w tym roku 50-lecia działalności kabaretu. Główną gwiazdą formatu będzie Jan Pietrzak, który, jak czytamy w oficjalnym komunikacie TVP, ""jest nie tylko autorem tekstów, ale wyśmienitym komentatorem społecznych i politycznych wydarzeń Polski"". Czyżby stacja zapomniała już o naganie, jaką dostała od KRRiT za retransmisję żartów satyryka? Przypomnijmy, że 6 sierpnia br. TVP Kultura wyemitowała jubileuszowy koncert Pietrzaka zorganizowany przez Klub Ronina w warszawskim Centrum Prasowym Foksal. W trakcie występu satyryk (który znany jest z niechęci m.in. do Donalda Tuska) nie szczędził krytyki Platformie Obywatelskiej i Nowoczesnej. Na antenie były też personalne ataki na np. Tomasza Lisa, Ewę Kopacz, Ryszarda Petru czy nawet Kubę Wojewódzkiego. Jak poinformowała Katarzyna Twardowska, rzecznik prasowa Krajowej Rady Radiofonii i Telewizji, w rozmowie z serwisem wirtualnemedia.pl, do KRRiT wypłynęło pięć skarg od widzów na żarty Pietrzaka w TVP Kultura. Zażalenia złożyli też posłowie Platformy Obywatelskiej. - Zdaniem skarżących poziom prostactwa i obelg przekroczył wszelkie normy, a pokazywanie takich treści, zwłaszcza przez Telewizję Polską, jest naganne - powiedziała Twardowska. Krajowa Rada Radiofonii i Telewizji poddała analizie wskazany materiał i skonfrontowała go z napływającymi skargami. W rezultacie KRRiT uznała, że ""w retransmisji koncertu znalazły się wypowiedzi, które można uznać za wulgarne, obelżywe i przekraczające normy dobrego obyczaju"". W wydanej opinii podkreślono również, że ""nie można usprawiedliwiać ich satyrycznym charakterem audycji"". Telewizja Polska została wezwana do zaniechania naruszania ustawy rtv.  Tutaj sprawdzisz aktualną ramówkę Telewizji WP  Tu pobierzesz za darmo aplikację Program TV:"
http://teleshow.wp.pl/krrit-nierzetelny-material-w-tvn24-o-teoriach-zespolu-macierewicza-na-temat-katastrofy-smolenskiej-6106895191647873a,"KRRiT: nierzetelny materiał w TVN24 o teoriach zespołu Macierewicza na temat katastrofy smoleńskiej Krajowa Rada Radiofonii i Telewizji uznała, że materiał wyemitowany w programie ""Czarno na białym"" narusza ustawę Prawa prasowego. 11 października 2016 roku TVN24 wyemitował w programie ""Czarno na białym"" reportaż Piotr Świerczka zatytułowany ""(Nie)czyste teorie"". Materiał zawierał m.in wizualizacje katastrofy smoleńskiej i opinie ekspertów, którzy opowiadali o ""teoriach, w których roi się od prostych matematycznych błędów i tych, które nawzajem się wykluczają"". Nie zabrakło również wątku badań, jakie przeprowadzała komisja Antoniego Macierewicza. Najwięcej krytycznych komenarzy padło pod adresem Glenna Joergensena, Wacława Berczyńskiego oraz prof. Wiesława Biniendy i to właśnie ten ostatni, za pośrednictwem swojej pełnomocniczki, Marii Szonert-Biniendy, złożył skargę na ten materiał do Krajowej Rady Radiofonii i Telewizji. KRRiT, po wnikliwej analizie dostarczonej dokumentacji, podjęła uchwałę, w której czytamy, że nakaze spółce TVN SA ""zaniechanie działań, polegających na niedochowaniu należytej rzetelności i staranności przy zbieraniu i wykorzystywaniu materiałów w audycji pt. ""(Nie)czyste teorie"", wyemitowanej w cyklu ""Czarno na białym"" w programie TVN24 w dniu 11 października 2016 roku"". Choć, zgodnie z prawem, stacja złożyła w tej sprawie obszerne wyjaśnienia, Krajowa Rada Radiofonii i Telewizji uznała wyjaśnienia nadawcy za niewystarczające. W najbliższym czasie Witold Kołodziejski, przewodniczący KRRiT, wyda nakaz usunięcia wszelkich nieprawidłowości. Nie podano jednak, które konkretnie informacje w reportażu zawierają błędy. TVN nie skomentowała decyzji Rady.  Tutaj sprawdzisz aktualną ramówkę Telewizji WP  Tu pobierzesz za darmo aplikację Program TV:"
http://teleshow.wp.pl/malgorzata-rozenek-majdan-w-obozowej-stylizacji-spodnie-gwiazdy-nie-spodobaly-sie-fankom-skojarzenia-sa-makabryczne-6107701953218689a,"Małgorzata Rozenek-Majdan w ""obozowej"" stylizacji? Spodnie gwiazdy nie spodobały się fankom. Skojarzenia są makabryczne I jednoznaczne. Osoby komentujące zdjęcia, które Małgorzata Rozenek-Majdan umieszcza na swoim instagramowym profilu, zasugerowały, że stylizacja gwiazdy nawiązuje do ubioru więźniów w... obozach zagłady. Pasiaste, podarte, sprane spodnie, do tego drewniane chodaki - te dwa elementy stroju gwiazdy telewizji nie przypadły do gustu osobom obserwującym Rozenek w sieci. Perfekcyjna Pani Domu do dżinsów, które wzbudziły mnóstwo kontrowersji, dodała niebieską koszulę i beżowy żakiet.  I choć góra stroju nie budziła zastrzeżeń, to dół wywołał falę emocji. W komentarzach zasugerowano pani Majdan, by usunęła fotografię: Niestety te chodaki i spodnie kojarzą się z jednym, ogromnym cierpieniem. Nie powinno się bawić modą aż do tego stopnia, takie jest moje zdanie. To jest niesmaczne. Nie stwierdzam, że zrobiła to Pani celowo, myślę że ktoś tak Panią ubrał, ale to zdjęcie powinno stąd zniknąć, jeżeli chce Pani uniknąć negatywnych opinii...no chyba, że to celowe działanie.... Ktoś inny dodał: Jak na standardy obozowe to można powiedzieć, że elegancko... a kiedy założy pani sobie koszulę na wzór z obozu koncentracyjnego z Korei Północnej?   Małgorzata Rozenek-Majdan nie odpowiedziała na negatywne komentarze, których było znacznie więcej niż pozytywnych. Znalazło się, co prawda, kilka osób broniących stylu gwiazdy, lecz nikt nie zakwestionował faktu, że pasiaki faktycznie kojarzą się bardziej z odzieżą obozową niż modnym elementem garderoby. A co wy uważacie?"
http://teleshow.wp.pl/syn-gasowskiego-i-sleszynskiej-idzie-w-slady-slawnych-rodzicow-22-letni-kuba-zagra-w-serialu-6109426519775361a,"Syn Gąsowskiego i Śleszyńskiej idzie w ślady sławnych rodziców. 22-letni Kuba zagra w serialu Na początku kwietnia ruszyły zdjęcia do serialu kryminalnego ""Belfer 2"". Tym razem Paweł Zawadzki (w tej roli Maciej Stuhr) podejmuje pracę w jednym z prestiżowych liceów we Wrocławiu. W nowej obsadzie znalazł się syn Hanny Śleszyńskiej i Piotra Gąsowskiego.  Po wyjaśnieniu zagadkowej śmierci 17-letniej Joanny belfer wraca do Wrocławia. To co wydarzy się w ciągu pierwszych dni w nowej szkole wywoła w nim wstrząs.  W liceum dochodzi do tragedii. Pojawia się milion pytań, na które nie ma odpowiedzi. Jedno jest jasne: na terenie liceum toczy się mordercza gra. To nie jest szkoła, jak każda inna. To nie są zwykli uczniowie, a Zawadzki nie znalazł się tam przypadkowo. Na ekranie pojawią się m.in. Michalina Łabacz (""Wołyń"", nagroda za debiut aktorski na 41. Festiwalu Filmowym w Gdyni), Eliza Rycembel (""Niewinne"", ""#Wszystkogra"", ""Obietnica"", nagroda Talent Trójki w kategorii Film), a także Jakub Gąsowski.  Syn aktorskiej pary na co dzień gra w Teatrze Hybrydy Uniwersytetu Warszawskiego, śpiewa w klubie Harenda, a od 2015 roku studiuje na Wydziale Aktorskim Akademii Teatralnej im. A. Zelwerowicza w Warszawie. W wieku 18 lat pracował jako reporter w ""Dzień Dobry TVN"". Był gospodarzem cyklu ""Ja w twoim wieku..."". ""Belfer"" to jeden z najlepszych polskich seriali ostatnich lat. Cykl otrzymał m.in. Polską Nagrodę Filmową Orły 2017 w kategorii Najlepszy Filmowy Serial Fabularny, Specjalną Telekamerę Tele Tygodnia 2017 w kategorii Serialowe Wydarzenie Roku oraz tytuł Wydarzenia Roku 2016 w plebiscycie Bestsellery Empiku.   Tutaj sprawdzisz aktualną ramówkę Telewizji WP  Tu pobierzesz za darmo aplikację Program TV:"
http://teleshow.wp.pl/ucho-prezesa-tvp-nie-zaprzecza-ze-prowadzi-rozmowy-w-sprawie-emisji-6081158362735233a,"""Ucho Prezesa"": TVP nie zaprzecza, że prowadzi rozmowy w sprawie emisji ""Ucho Prezesa"" w TVP? Nie jest to takie nieprawdopodobne, jak mogłoby się wydawać. Jak podaje ""Fakt"", Jacek Kurski jest zainteresowany emisją serialu Roberta Górskiego. Zapytaliśmy rzecznika TVP, czy faktycznie ma takie plany. ""Ucho Prezesa"" to serial w zabawny sposób ukazujący wizję Roberta Górskiego na to, jak wygląda praca rządu. Kabareciarze wcielają się w role między innymi Antoniego Macierewicza, Mariusza Błaszczaka, a sam Górski brawurowo parodiuje prezesa Kaczyńskiego. Produkcja od razu stała się hitem sieci, a każdy odcinek ma po kilka milionów odsłon na Youtubie. Jak zapewniał twórca, serial trafił do sieci, bo żadna stacja nie chciała go emitować. Tymczasem po ogromnym sukcesie w sieci, zainteresował się nim sam Jacek Kurski. Menadżerka Roberta Górskiego nie chce komentować sprawy, natomiast TVP w wysłanej do nas odpowiedzi enigmatycznie nie potwierdza, ani nie zaprzecza tym informacjom. ""Redakcje Rozrywki TVP prowadzą liczne rozmowy i negocjacje w sprawie różnych programów rozrywkowych, które mogą wzbogacić ofertę Telewizji Polskiej w tym zakresie"" informuje WP Teleshow rzecznik prasowy TVP. Według informacji Faktu Kurski uważa, że emisja ""Ucha Prezesa"" w TVP mogłaby uciąć krytykę i pokazać dystans stacji. Wpływ na jego zainteresowanie serialem ma zapewne wypowiedź samego Jarosława Kaczyńskiego dla ""Radia Szczecin"". Prezes przyznał, że oglądał serial w sieci, a jedyny problem, jaki dostrzegł, to sceny z kotem.– Koty dorosłe mleka nie piją. Zresztą z kotem jest w ogóle wielkie nieporozumienie, bo ten rudy kot, który występuje w internecie jako mój, to nie jest mój kot – z uśmiechem skomentował Kaczyński.  Nie wszyscy jednak są tak wyrozumiali jak Jarosław Kaczyński. Krystyna Pawłowicz ostro skrytykowała ""Ucho Prezesa"". Jej wpis można przeczytać tutaj:"
