links,bodies
http://tech.wp.pl/polaczyli-mysliwiec-pojazd-batmana-i-lodz-w-jedna-maszyne-6034792161666177a,"Połączyli myśliwiec, pojazd Batmana i łódź w jedną maszynę Amerykańska firma Juliet Marine Systems postanowiła zbudować łódź, która porusza się w zupełnie inny sposób niż dotychczas budowane konstrukcje. Zamiast klasycznego kadłuba i śruby napędowej wykorzystano zanurzone w wodzie skrzydła, które unoszą całą konstrukcję do góry. Ma to sprawić, że GHOST - jak go nazwano - będzie ekstremalnie szybki. Na pierwszy rzut oka konstrukcja może nieco przypominać wodoloty. W ich przypadku pod kadłubem zamontowane są specjalne płaty nośne, które wraz ze wzrostem prędkości unoszą całość do góry. Ta konstrukcja ma jednak sporo wad, z których dwie największe to bardzo niska dzielność morska (mogą pływać tylko na spokojnych wodach) oraz ogromna paliwożerność. Konstruktorzy Ghosta podeszli do sprawy inaczej i postanowili w jego przypadku wykorzystać efekt superkawitacji. Jest to zjawisko fizyczne, które polega na powstaniu wokół obiektu zanurzonego w cieczy bąbla gazowego otaczającego cały ten obiekt. Dzieje się tak wtedy, kiedy wytwarzane są silne wibracje, lub gdy obiekt porusza się z dużymi prędkościami. To zaś wpływa na znaczące obniżenie oporów wody. Producent twierdzi, że jego konstrukcja jest w stanie poruszać się przy tarciu aż o 90. razy mniejszym, niż klasyczne jednostki z kadłubem zanurzonym w wodzie. W pierwszej kolejności firma chciałaby wyprodukować pojazdy w konfiguracji przeznaczonej dla armii, dlatego cały projekt podporządkowano wojskowym wymaganiom. Przede wszystkim został on zbudowany w technologii Stealth, czyli jest praktycznie niewykrywalny przez radary i może zostać lekko uzbrojony. Potencjalna lista zastosowań jest jednak znacznie większa. Tego typu maszynę można użyć do patrolowania granic morskich i wód przybrzeżnych, może być wykorzystana w służbach celnych, jako szybki pojazd medyczny i ratowniczy, pojazd ochraniający flotę handlową przed piratami, a nawet jako zwyczajny, cywilny pojazd transportowy. Całość konstrukcji przypomina wyglądem odwróconą literę V. Skrzydła połączone z kadłubem podczas postoju pozostają w większości pod powierzchnią wody. Dopiero po osiągnięciu pewnej prędkości (około 8 węzłów) pilot może zmienić ich ustawienie. Różny kąt ich odchylenia ma służyć odmiennym zadaniom. Inna charakterystyka przydatna jest przy wolnym patrolowaniu wód, a inna potrzebna jest przy szybkim pościgu. Za stabilność konstrukcji odpowiada system żyroskopów i cyfrowej kontroli położenia. Na końcu każdego ze skrzydeł zamontowano specjalne pływaki, w których zamontowano układ napędowy oraz układ odpowiadający za wytworzenie efektu superkawitacji. Co ciekawe, większość kluczowych elementów jak np. komputery sterujące również zamontowanych jest pod wodą, co ma zapewnić ich większe bezpieczeństwo w przypadku ataku. Cała konstrukcja powstała w oparciu o aluminium i stal o wysokiej odporności na korozję. Za napęd służą turbiny gazowe o mocy 200. koni mechanicznych każda. Układ napędowy odpowiedzialny jest również za wytworzenie bańki powietrza otaczającej zanurzone w wodzie elementy i umożliwiając tym samym osiągnięcie wysokich prędkości przy stosunkowo niewielkim zużyciu paliwa. To z kolei przekłada się na duży zasięg operacyjny. Pojazd może przewozić maksymalnie 10 pasażerów, a jego załoga w wersji wojskowej składa się z trzech osób. W wersji cywilnej załoga liczy dwie osoby. Niestety, producent ma wciaż problemy z osiągnięciem wysokich prędkości, jakie obiecuje. Pierwsze egzemplarze testowe mogą się rozpędzić do prędkości zaledwie 29 węzłów (około 53 km/h). Firma twierdzi jednak, że jest w stanie zwiększyć ją do 50 węzłów (około 92 km/h). Koszt jednego egzemplarza to około 1. milionów USD."
http://tech.wp.pl/jednonogi-postrach-nazistow-najgrozniejsza-agentka-aliantow-zaczela-kariere-w-warszawie-6113951807960705a,"Jednonogi postrach nazistów. Najgroźniejsza agentka aliantów zaczęła karierę w Warszawie Virginia Hall została uznana przez III Rzeszę za najgroźniejszego agenta aliantów. Choć miała tylko jedną nogę, z zapałem realizowała rozkaz Churchilla: podpalić Europę.  Gdyby nie nieszczęśliwy wypadek, Virginia Hall zapewne nigdy nie zostałaby tajną agentką. Od dzieciństwa marzyła o służbie w amerykańskiej dyplomacji i konsekwentnie, krok po kroku to marzenie realizowała.  Zdobyła świetne wykształcenie, liczne podróże zagraniczne dały jej obycie w świecie, a pracowita nauka języków sprawiła, że po ukończeniu dwóch żeńskich college’ów władała biegle francuskim, włoskim i niemieckim. Dyplomatyczna kariera stała przed nią otworem i w wieku 25 lat Virginia trafiła do swojej pierwszej placówki, którą była ambasada amerykańska w Warszawie, zmieniona następnie na placówki w Estonii, Turcji i Austrii. Błyskotliwie zapowiadająca się kariera legła jednak w gruzach za sprawą nieszczęśliwego wypadku. Przypadkowy postrzał w nogę podczas polowania zakończył się amputacją, a fizyczny defekt z miejsca przekreślił szanse na pracę w korpusie dyplomatycznym. W 1939 roku Virginia Hall ostatecznie zrezygnowała z pracy w dyplomacji. Niemiecki atak na Francję zastał ją w Paryżu. Jeszcze niezwiązana z działalnością wywiadowczą jako ochotniczka podjęła się pracy kierowcy ambulansu.  Brała również udział w organizowaniu pomocy dla zestrzelonych pilotów, a po podpisaniu przez Francję zawieszenia broni wraz z ewakuowanymi z kontynentu żołnierzami trafiła do Anglii. Tam zainteresowało się nią Kierownictwo Operacji Specjalnych (Special Operations Executive – SOE), czyli powołana przez Winstona Churchilla tajna agencja.  Jej zadanie brytyjski premier nakreślił krótko: podpalić Europę. Wkrótce okazało się, że werbując Virginię Hall, SOE nie mogło trafić lepiej. Z nową tożsamością, jako Marie Monin, korespondentka ""New York Post"" (Stany zjednoczone nie były wówczas w stanie wojny z Niemcami), Virginia powróciła do Francji. Przez 15 miesięcy działała w Lyonie, gdzie zajęła się organizowaniem francuskiego ruchu oporu.  Ważnym aspektem działalności była również antyniemiecka propaganda wśród niezaangażowanych początkowo w konspirację Francuzów – wydawana przez nią podziemna prasa trafiła do 2 mln czytelników! Oficjalnie przyłączenie się Stanów Zjednoczonych do wojny zmusiło Virginię do ucieczki. Przez Pireneje przedostała się nielegalnie do Hiszpanii, gdzie została wtrącona do więzienia, jednak interwencja brytyjskich służb dyplomatycznych doprowadziła do jej uwolnienia. Na własną prośbę – mimo obiekcji przełożonych – agentka zdecydowała się na powrót na okupowany kontynent, tym razem już jako agentka Biura Służb Strategicznych, czyli poprzednika CIA. Legenda głosi, że Virginia Hall powróciła do Francji, skacząc ze spadochronem na jednej nodze, bo protezę trzymała w plecaku. Jak to często bywa z legendami, prawda jest jednak inna – kanał La Manche Virginia pokonała na pokładzie ścigacza torpedowego. Prawdziwa jest za to inna opowieść – drewniana noga agentki faktycznie zyskała swój konspiracyjny pseudonim i w depeszach była nazywana Cuthbertem. Aby Cuthbert nie rzucał się zanadto w oczy, Virginia przyjęła rolę staruszki, której szerokie stroje maskowały protezę. Jako producentka koziego sera miała kontakt z niemieckimi żołnierzami i mogła podsłuchiwać ich rozmowy. Zorganizowała we Francji sieć wywiadowczą, dostarczającą aliantom regularne meldunki. Zorganizowała również szkolenia dla ruchu oporu, pomagając w przygotowaniu do walki trzech batalionów Resistance.  Jej działalność nie pozostała niezauważona. Jak wynika z przechwyconej komunikacji niemieckich służb, działające we Francji Gestapo uznało ""kulejącą damę"" za najbardziej niebezpiecznego alianckiego szpiega, którego należy bezwzględnie zlikwidować. Warto przy tym rozprawić się z mocno zakorzenionym mitem, dotyczącym francuskiego ruchu oporu. Popularny dowcip głosi, jakoby francuskie podziemie było tak doskonale zakonspirowane, że o jego istnieniu nigdy nie dowiedzieli się ani Francuzi, ani Niemcy.  Nic dziwnego - chyba nic nie ukształtowało wizji francuskiego ruchu oporu skuteczniej niż popularny przed laty serial komediowy ""Allo Allo"", prezentujący konspirujących Francuzów jako – oględnie rzecz ujmując – niezbyt skutecznych. Nie ma w tym wiele prawdy. Choć francuski ruch oporu (albo raczej ruch oporu we Francji – tworzyli go bowiem ochotnicy wielu narodowości, w tym około 40 tys. Polaków) nigdy nie osiągnął takiej skali jak polskie  podziemne państwo czy partyzantka jugosłowiańska, to bagatelizowanie roli Resistance jest pozbawione podstaw. Po lądowaniu w Normandii zorganizowane przez Virginię Hall oddziały rozpoczęły walkę, mając na koncie – poza znacznymi zniszczeniami infrastruktury – m.in. wzięcie do niewoli 500 niemieckich żołnierzy. Virginia nawiązała wówczas kontakt z jedną z grup dywersyjnych, przerzuconych do Europy w ramach operacji Jedburgh. W przeciwieństwie do głęboko zakonspirowanych agentów, dywersanci byli przerzucani z dużą ilością wojskowego zaopatrzenia i w pełnym umundurowaniu. Dzięki temu prowadząc swoją działalność poza liniami wroga, w razie schwytania nie mogli być oskarżani o szpiegostwo i przysługiwały im prawa jeńców wojennych. Walka Virginii Hall w Europie dobiegła końca we wrześniu 1944 roku, gdy jej oddział połączył się z regularnymi wojskami aliantów. Po wojnie doświadczona agentka nie porzuciła pracy w zawodzie. Zasiliła szeregi utworzonego w ramach CIA Wydziału Działań Specjalnych (Special Activities Division – SAD). O znaczeniu SAD dobitnie świadczy fakt, że praca w nim stanowi najwyższy stopień kariery w amerykańskich jednostkach specjalnych – to tam trafiają najlepsi z tak ikonicznych formacji jak ISA, Delta, DEVGRU czy 24th STS. Istnienie SAD nie jest tajemnicą, jednak o szczegółach organizowanych operacji wiadomo bardzo niewiele. Jedną z nielicznych potwierdzonych informacji jest fakt, że większość gwiazdek na ścianie pamięci w centrali CIA, symbolizujących agentów poległych w czasie misji, należy właśnie do agentów SAD.  Po drugiej wojnie Virginia Hall nie pozbyła się konspiracyjnych nawyków. Gdy po kapitulacji Niemiec prezydent Harry Truman chciał wręczyć jej Krzyż za Wybitną Służbę – drugie po Medalu Honoru amerykańskie odznaczenie wojskowe – Virginia odmówiła, nie chcąc pokazywać twarzy w czasie oficjalnej uroczystości. Pozostała w służbie do 1966 roku.  Warto przy tym wspomnieć, że sama agentka swoje działania w czasie drugiej wojny określała mianem ""zaledwie sześcioletniego epizodu"", co daje bardzo szerokie pole do interpretacji: to podziwu godna skromność czy odniesienie do powojennej aktywności, przypadającej przecież na najbardziej gorący okres zimnej wojny? Tego prawdopodobnie nie dowiemy się nigdy. Virginia Hall zmarła w 1982 roku, zapisując się przy okazji w historii jako amerykański szpieg, wyróżniony największą liczbą różnych orderów. To ironia losu, że ikoniczną postacią kobiety superszpiega stał się pionek w grze wywiadów, jakim była niezasłużenie słynna Mata Hari. Te prawdziwe, niezwykle skuteczne i ważne agentki, jak choćby Krystyna Skarbek, Nancy Wake czy Virginia Hall przez dziesięciolecia pozostawały w cieniu, co – zważywszy na charakter ich działalności – wydaje się całkiem dobrą rekomendacją. Być może Virginia Hall niebawem z niego wyjdzie i doczeka się należnego miejsca w popkulturze – wytwórnia Paramount Pictures pracuje właśnie nad ekranizacją jej biografii. W głównej roli wystąpi Daisy Ridley, znana z roli Rey w filmie ""Gwiezdne wojny: Przebudzenie mocy""."
http://tech.wp.pl/ukm-2000p-polski-karabin-maszynowy-trafi-do-wojsk-obrony-terytorialnej-6113386332887169a,"UKM-2000P. Polski karabin maszynowy trafi do Wojsk Obrony Terytorialnej UKM-2000P to polski karabin maszynowy. Chociaż powstał w 2004 roku, do tej pory do polskiego wojska trafiło mniej niż 1500 sztuk. Chrzest bojowy przeszedł podczas wojny w Afganistanie, a teraz trafi do żołnierzy Wojsk Obrony Terytorialnej. MON zamówił 2500 szt. UKM-2000P. UKM-2000P to polski karabin maszynowy, który powstał na bazie radzieckiego karabinu PKM (pulemiot Kałasznikowa) kalibru 7,62 x 54 mm R. Prace nad nim rozpoczęły się w latach 90., gdy Polska przystąpiła do programu ""Partnerstwo dla Pokoju” i starała się o wejście do NATO. Jednym z wymogów przystąpienia do sojuszu było przyjęcie tych samych standardów amunicji w używanej broni. Możliwości były dwie. Jedną z nich było dostosowanie broni do nowej amunicji. Tak powstał używany dziś przez Wojsko Polskie karabinek Beryl kalibru 5,56 mm. Jest to karabin AK, w którym zmodyfikowano przede wszystkim lufę i komorę zamkową.  Przy dostosowywaniu do nowej amunicji karabinu maszynowego PKM na początku zastosowano taką samą strategię jak przy Berylu. Fabryka Hipolita Cegielskiego w Poznaniu, która od lat 70. produkowała w Polsce karabiny PKM, zaproponowała  wojsku wersję PKM-N (literka N od NATO) z lufą i komorą zamkową odpowiadającą natowskiej amunicji 7,62 x 51 NATO. Wojsko nie zdecydowało się jednak na ten wariant i w 1998 roku na Wojskowej Akademii Technicznej rozpoczęto prace nad nową bronią nazwaną już wtedy UKM-2000 (skrót od Uniwersalny Karabin Maszynowy, a 2000 to rok, w którym broń miała być gotowa). Przy projektowaniu nowej konstrukcji opierano się głównie na  budowie sprawdzonego, radzieckiego karabinu PKM, ale czerpano też z rozwiązań zastosowanych w niemieckim MG 42 i szwajcarskim SIG 710-3. Ukończony w 2004 roku UKM-2000 z zewnątrz przypomina swój radziecki pierwowzór, ale znacznie się od niego różni. Ze względu na oszczędności nowy karabin miał być kompatybilny z uchwytami  na broń stosowanymi przy PKM, a także z pokrowcami i skrzynkami amunicyjnymi.  Docelowo powstało kilka modeli UKM-2000. Z oznaczeniem P – dla piechoty, D – ze składaną kolbą dla wojsk desantowych, C – z elektronicznym spustem jako broń pokładowa  w transporterach Rosomak. Mimo że UKM-2000 został oceniony bardzo pozytywnie i przeszedł rygorystyczne testy, to Wojsko Polskie nie zdecydowało się na szybką wymianę znajdujących się na stanie karabinów PKM. Do końca 2011 roku zamówiło tylko 1000 UKM-2000.  UKM-2000 po raz pierwszy został sprawdzony w warunkach bojowych podczas polskiej misji w Afganistanie. Wtedy pojawiły się też uwagi żołnierzy co do działania i ergonomii broni. Producent karabinu, Zakłady Mechaniczne Tarnów, przystąpił do modernizacji broni. Wprowadzono 26 zmian w konstrukcji, które obejmowały m.in.: komorę zamkową, donośnik, zamek, urządzenie wylotowe, wyrzutnik, wprowadzenie amortyzatora suwadła, umożliwienie strzelania amunicją ślepą bez dodatkowej wkładki, lufę wykonaną w nowej technologii, odmienną kolbę oraz zespół szyn przednich z chwytem. Karabin przystosowano do obsługi natowskiej taśmy amunicyjnej  M13, zwiększono też możliwości działania w ekstremalnych temperaturach od -50 st. C do +55  st. C (przy wilgotności 95 proc.). Zmieniono kolbę, dołożono szyny montażowe, a metalowe skrzynki amunicyjne zastąpiono lżejszymi."
http://tech.wp.pl/gbu-43b-matka-wszystkich-bomb-to-ja-amerykanie-zrzucili-w-afganistanie-6111881217738369a,"GBU-43/B. ""Matka wszystkich bomb”. To ją Amerykanie zrzucili w Afganistanie 13 kwietnia siły USA w Afganistanie zrzuciły 11-tonową bombę GBU-43/B na kompleks jaskiń i tuneli wykorzystywanych przez tzw. Państwo Islamskie. Jest to największa w historii, nienuklearna bomba jakiej użyto w walce. Bomba waży 10 300 kg, ma ponad 9 m długości i ponad 100 cm w obwodzie. Jest zbyt duża, aby zmieścić się w luku amerykańskich bombowców. Do jej transportu wykorzystano zmodyfikowaną wersję samolotu C-130 Hercules, który zrzucił ją  przez tylną rampę jak zwykły ładunek. Po opuszczeniu samolotu GBU-43/B jest stabilizowana, a na cel naprowadzą ją komputer i GPS.  GBU-43/B nie jest bombą ""penetrującą”, która służy do niszczenia bunkrów i innych mocno ufortyfikowanych celów. Taką jest np. bomba JDAM. ""Matka wszystkich bomb” jest detonowana nad ziemią (tzw. ""airburst”) dla zwiększenia zasięgu, jej przeznaczeniem jest zniszczenie nieopancerzonych i słabo chronionych celów na jak największym obszarze.  Kosztująca 16 mln dolarów z sztukę bomba GBU-43/B została zaprojektowana i zbudowana w Laboratorium Badawczym Sił Powietrznych w 2003 roku, podczas wojny w Iraku. Jest największą konwencjonalną, czyli nienuklearną bomba użytą bojowo, nie jest jednak największą bombą w ogóle. Amerykanie mają w swoim arsenale GBU-57A/B Massive Ordnance Penetrator, niszczyciela bunkrów o wadze 14 ton. Z kolei Rosjanie testowali w 2007 roku termobaryczną bombę nazwaną ""Ojcem wszystkich bomb” o sile czterokrotnie większej niż ""matka”."
http://tech.wp.pl/f-16-przeprowadzil-test-z-bomba-jadrowa-6113307333076609a,"F-16 przeprowadził test z bombą jądrową Siły Powietrzne USA przeprowadziły test najnowszej wersji kierowanej bomby termojądrowej  B61 Mod 12. Po raz pierwszy do testów wykorzystano samolot F-16C. Do tej pory USAF (Siły Powietrzne Stanów Zjednoczonych) do testów bomby B61 w wersji Mod 12 wykorzystywały większy, dwusilnikowy samolot F-15E Strike Eagle. Próba z F-16 odbyła się w bazie 422 Eskadry Doświadczalnej w Nellis w stanie Nevada. Jej celem było sprawdzenie możliwości F-16 do przeprowadzenia taktycznego ataku jądrowego.  Oprócz tego testowane były mechanizmy samej bomby, takie jak: uzbrajanie, naprowadzanie, system kontroli detonacji, wysokościomierz, silniki sterujące lotem oraz komputer pokładowy. W trakcie testu bomba nie była wyposażona w ładunek jądrowy. Bomba B61 to grawitacyjna bomba jądrowa, która powstała w latach 60. Obecnie USAF prowadzi kosztujący ponad 10 mld dolarów program wydłużenia okresu przydatności bomb. Bomba B61 w wersji Mod 12 ma być dostosowana do przenoszenia przez bombowce strategiczne B-2A, B-21 oraz myśliwce F-15E, F-16C/D, F-35. Natomiast w ramach programu udostępniania broni nuklearnej sojusznikom NATO B61 będzie mogła być używana także przez belgijskie i holenderskie F-16 MLU, tureckie F-16C/D oraz niemieckie i włoskie Tornado PA-200. B61 ma regulowaną moc ładunku termojądrowego, różni się ona też w zależności od modelu. Strategiczna wersja (Mod 7) może mieć maksymalny ładunek o mocy 340 kiloton. Modernizacja do wersji Mod 12 ograniczy moc bomby do maksymalnych 50 kiloton. W Z kolei do celów taktycznych, czyli atakowania przeciwnika blisko własnych wojsk, bomba będzie mogła mieć moc 0,3, 5 lub 10 kiloton. Dla porównania ""Little Boy”, czyli bomba atomowa zrzucona na Hiroshimę, miała moc 15 kiloton, a „Matka wszystkich bomb” zrzucona w Afganistanie miała moc 11 ton."
http://tech.wp.pl/rosyjski-latajacy-czolg-poteznie-uzbrojony-i-mocno-opancerzony-6112736396425345a,"Rosyjski latający czołg – potężnie uzbrojony i mocno opancerzony Samoloty szturmowe bywają czasem określane mianem latających czołgów. Tak nazywano amerykański samolot A10 Thunderbolt II, ale także bardzo potężną maszynę wyprodukowaną jeszcze w Związku Radzieckim – Suchoj Su-25. Samolot jest tak odporny, że bez problemu startuje nawet prowizorycznych lotnisk na trawie czy błotnistych łąk. Jednak to nie dlatego jest taki groźny. Pod jego skrzydłami można zawiesić cały arsenał broni, a jego opancerzona konstrukcja – wiele elementów kadłuba pokrytych jest dodatkowymi, tytanowymi osłonami albo stalowym pancerzem – pozwala mu przetrwać ostrzał. Samoloty te uczestniczyły w wielu konfliktach zbrojnych – od wojny w Zatoce Perskiej, aż po obecny konflikt w Syrii. Su-25 nie jest najnowocześniejszą konstrukcją, jaką możemy spotkać w lotnictwie wojskowym, ale na tyle dobrą, że samolot jest produkowany do dzisiaj. Pierwszy oblot maszyny wykonano w roku 1975, a pierwsze egzemplarze wyprodukowano w roku 1978.  Początkowo wojskowi mieli zastrzeżenia do samej idei tego samolotu, jednak po udanych testach i sprawdzeniu maszyny w realnych warunkach bojowych zmienili zdanie. Oficjalnie na stan armii samolot trafił w roku 1987. Su-25 jest samolotem, którego głównym zadaniem jest wspieranie piechoty - to typowy samolot szturmowo-uderzeniowy. W związku z tym nie musi on osiągać wysokich prędkości, jednak w zamian za to musi być zdolny do lotu na niskim pułapie, a także bardzo sprawnie manewrować.  Loty na niskich wysokościach, w większości nad terytorium wroga, wymusiły na konstruktorach silne opancerzenie samolotu.  Kabina pilotów chroniona jest tytanowymi płytami o grubości od 10 do 25 mm. W podobny sposób chronione są silniki. Pancerz bez problemu zapewnia ochronę załogi i kluczowych elementów samolotu przy ostrzale z broni maszynowej i działek do kalibru 23 mm. Również dla bezpieczeństwa przeniesiono zbiorniki paliwa ze skrzydeł, do wnętrza kadłuba. O tym, jak odporny na ostrzał jest samolot pokazała wojna w Afganistanie. Maszyny wracały do bazy o własnych siłach z 80-90 uszkodzeniami od pocisków, a niekiedy nawet ze 150 przestrzeleniami kadłuba. Łącznie wykonały w Afganistanie ponad 60 000 lotów i okazały się znacznie odporniejsze od jakiejkolwiek innej maszyny. Samolot napędzany jest dwoma silnikami R-95Sz bez dopalaczy, o ciągu 40,2 kN każdy. W nowszych wersjach zamontowane są silniki R-195, które mają większy ciąg (44,1 kN) oraz trzykrotnie niższą temperaturę gazów wylotowych, dzięki czemu trudniej trafić w maszynę pociskami kierowanymi na podczerwień.  Su-25 może się rozpędzić do prędkości 950 km/h i wzbić się na maksymalny pułap 7000 metrów – dla porównania, samoloty pasażerskie na dłuższych trasach wzbijają się na wysokość nawet 11000 metrów. Zasięg szturmowca to około 500 km.  Samolot to prawdziwa latająca forteca. Konstruktorzy wyposażyli go w aż 10 węzłów, do których można podwiesić różne rodzaje uzbrojenia. Su-25 może pod skrzydłami przenosić bomby (każda o masie 500 kg), niekierowane pociski rakietowe, pociski rakietowe naprowadzane laserowo, zasobniki strzeleckie i zasobniki bombowe. Nie zabrakło także podwójnego działka kalibru 30mm, które zdolne jest do wystrzeliwania 3000 pocisków na minutę. Do samoobrony Su-25 wykorzystuje natomiast dwa pociski klasy „powietrze-powietrze”. Rosjanie wciąż modyfikują i rozwijają konstrukcję. Najnowsze wersje samolotu daleko różnią się od pierwszych egzemplarzy z lat 80. ubiegłego wieku. Oprócz mocniejszych silników zmodyfikowano awionikę oraz systemy sterowania ogniem. Warto w tym miejscu zaznaczyć, że na pokładzie znajduje się tylko jeden pilot, który odpowiada za całość misji – pilotuje maszynę i jednocześnie niszczy cele. Według opinii niezależnych ekspertów modernizacja pozwoli na korzystanie z Su-25 przez przynajmniej kilkanaście kolejnych lat."
