links,bodies
http://tech.wp.pl/albo-wolnosc-albo-nic-czyli-jak-millenialsi-zmieniaja-swiat-6094651670971009a,"Albo wolność, albo nic, czyli jak millenialsi zmieniają świat Millenialsi to wcale nie roszczeniowi, egoistyczni i uzależnieni od komórek ludzie. To pokolenie, które zmienia technologię na lepszą, wygodniejszą i bardziej dostosowaną do nowoczesnego stylu życia. Na pewno kiedyś na nich trafiliście. Siedzieli na ławce w parku, ale nie rozmawiali ze sobą, tylko chichotali nad telefonami. Może szli chodnikiem jak zombie, nie zważając na ludzi idących z naprzeciwka, albo robili relację live z koncertu, zamiast skupić się na muzyce? Być może ich widzieliście, a może sami nimi jesteście – prawdopodobieństwo jest bardzo wysokie. Już teraz ponad połowa ludzi w internecie to tzw. millenialsi, czyli osoby urodzone pomiedzy 1989 a 2000 rokiem. W dużej mierze nie pamiętają, a na pewno nie wyobrażają sobie życia bez nowoczesnych gadżetów i stałego, szybkiego łącza internetowego. Millenialsi wchodzą w dorosłość i choć jeszcze nie śpią na pieniądzach, to już niebawem ich portfele będą grubsze niż w przypadku innych grup wiekowych. Innymi słowy, to oni będą zarządzali domowymi budżetami i podejmowali decyzje zakupowe. Część już wcześniej swoimi wyborami kształtowała rozwój technologii. Wygrana Facebooka z MySpace i przebojowość Snapchata, ale także popularność elastycznych ofert na telewizję (np. subskrypcja Netfliksa) czy telefon (samodzielnie komponowany abonament Virgin Mobile) – te wszystkie epizody z najnowszej historii da się wytłumaczyć wpływem millenialsów. „Me, me, me” – taki tekst znalazł się na okładce jednego z niedawnych wydań ""Timesa"", poświęconego millenialsom, podsumowując w ten sposób całą generację. Pod napisem widnieje dziewczyna robiąca sobie selfie. W 2013 roku ""Oxford Dictionary"" uznał „selfie” za brytyjskie słowo roku. Odpowiedź na rynku technologicznym na wszechobecne „ja, ja, ja” była praktycznie natychmiastowa. Klienci wybierali telefony z najlepszymi przednimi aparatami, chcąc, aby ich zdjęcia wyglądały jak najlepiej (co w prostej linii przekładało się na większy „fejm”, czyli popularność w mediach społecznościowych). iPhone 4 z 2010 roku w przednim aparacie miał zamontowaną matrycę 0,3 Mpx, która w najlepszym wypadku nadawała się do rozmów na Skypie - jeśli odbiorcy nie przeszkadzało, że nie może wykoncypować, gdzie rozmówca się zaczyna, a gdzie kończy. Zeszłoroczny iPhone 7 ma już z przodu matrycę 7 Mpx. Nie jest to jedynie różnica w postępie technologicznym, ale zupełnie inne podejście do projektowania telefonów, gdzie przedni aparat nie jest tylko niepotrzebnym gadżetem. Jeszcze dalej poszło chińskie Oppo, które w modelu N3 zaserwowało obracaną głowicę aparatu, kończąc dyskryminację jednej ze stron. Moda na transmitowanie własnych odczuć, odwiedzanych miejsc czy wykonywanych czynności rozwija się równolegle w segmencie oprogramowania – w końcu gdzieś tymi selfie trzeba się pochwalić. Badania pokazują, że 55 proc. amerykańskich millenialsów opublikowało selfie w internecie. Biorąc pod uwagę całe społeczeństwo, jest to 26 proc.  Medium społecznościowym skoncentrowanym praktycznie na jednej osobie – właścicielu telefonu – jest Snapchat - stworzony przez millenialsów i dla millenialsów. Jego wyróżnikiem są nie tylko znikające po określonym czasie zdjęcia, ale również maski nakładane na twarze. Bardziej „tradycyjny” Instagram z kolei ma już ponad 250 mln zdjęć z tagiem #selfie. Badanie z 2015 roku pokazało, że przeciętny millenials publikuje 9 selfie tygodniowo i nad każdym z nich spędza średnio 7 minut. W sumie daje to ponad godzinę tygodniowo tylko z „selfiakami” (takiego neologizmu użyła kiedyś Agata Młynarska na określenie selfie). Niedługo po pojawieniu się, Snapchat pozwolił na transmitowanie siebie (i nie tylko), czyli relacje na żywo. Coś, co wcześniej zarezerwowane było tylko dla reporterów telewizyjnych, teraz stało się udziałem wszystkich. Każdy może przeprowadzić transmisję z otwarcia nowego stadionu czy wypadku w centrum miasta. Kiedyś trzeba było brać ze sobą ciężką kamerę albo wręcz zatrudniać ludzi, aby przywieźć świetny materiał z podróży, a teraz wystarczy mała kamerka sportowa i selfie stick. I nie jest potrzebna nawet osobna aplikacja, bo już teraz identyczną funkcję ma także Facebook (i mocno ją promuje). Nie tylko każdy jest w stanie tworzyć treści, ale też każdy może z nimi dotrzeć do szerokiej grupy ludzi w mediach społecznościowych. Stworzyło to ciekawą sytuację, kiedy rywalem dla wydawcy internetowego jest nie tylko inny wydawca, ale również film ze śmiesznym kotkiem, zdjęcie celebryty czy post znajomego. Konsumpcja wszystkich tych treści zajęłaby zbyt dużo czasu, trzeba więc wybierać. Jak wiemy z doświadczenia, w wielu wypadkach to koty wygrywają… Otaczamy się ogromną liczbą kanałów z nieustającymi dystrakcjami, a doba ma i miała tyle samo czasu dla każdego pokolenia. Dlatego millenialsi są bardzo nietolerancyjni dla stron internetowych czy aplikacji, które każą im czekać. Badania pokazują, że jeśli strona ładuje się dłużej niż 4 sekundy, to co czwarty użytkownik rezygnuje z jej odwiedzin. Podobnie jest w przypadku aplikacji, zwłaszcza tych zakupowych. Raport Forrestera pokazuje, że 57 proc. kupujących rezygnuje z zakupu, jeśli nie uzyska natychmiastowej odpowiedzi na pytania odnośnie wybranego produktu. Zapewnienie odpowiedniej pomocy jest jednym z czynników, które sprawiają, że jedni zdobywają klientów, a inni nie. Widać to szczególnie w popularności aplikacji typu LiveChat, które pozwalają na szybki kontakt z obsługą w razie jakichkolwiek pytań. Kiedy alternatywa znajduje się w zasięgu jednego pytania zadanego wyszukiwarce Google, po prostu nie ma sensu tracić czasu na próby zrozumienia skomplikowanych usług. Przetrwają tylko te najbardziej intuicyjne. Ogromny ślad na millenialsach zostawia z pewnością spopularyzowanie tzw. gospodarki na żądanie, której świetnym przykładem jest Uber czy AirBnb. Jej naczelną ideą jest odrzucenie posiadania na rzecz wypożyczania albo dzielenia. Zupełnie abstrakcyjne z tego punktu widzenia jest przykładowo posiadanie umowy na telewizję z tysiącem miesięcznie opłacanych kanałów, których nigdy się nie oglądało. Dzięki usługom takim jak Netflix czy Hulu znacznie popularniejszy jest streaming, z którego korzysta 70 proc. amerykańskich millenialsów. A jak za oceanem ma się płatna telewizja? Począwszy od 2014 roku korzysta z niej coraz mniej gospodarstw domowych. Personalizowane buty czy koszulki to tylko początek. W internecie każdy z nas widzi teraz spersonalizowane reklamy, spersonalizowany News Feed na Facebooku i spersonalizowane wyszukiwania w Google. Ba, mamy nawet aplikacje podające spersonalizowane wiadomości ze świata. Millenialsi lubią mieć wszystko podane jak na tacy, ale w takich proporcjach, aby odpowiadało to ich potrzebom. To jeszcze nie wszystko. 40 proc. millenialsów chce współtworzyć produkty, których używa. Jeden rozmiar nie pasuje wszystkim, a każdy chce być szczególny i wyróżnić się z tłumu. Skończyły się więc czasy jednej oferty telekomunikacyjnej z określonym limitem rozmów czy SMS-ów. Za tym trendem podąża choćby Virgin Mobile, który pozwala klientom samodzielnie komponować, zmieniać i zawieszać abonament, wybierając zależnie od potrzeb pakiety internetu, minut i SMS-ów. Co ciekawe, w prezencie za wybranie nielimitowanych rozmów i SMS-ów największy w Polsce wirtualny operator telefonii komórkowej oferuje darmowe 20 GB internetu miesięcznie przez pół roku. Za całość płaci się wówczas jedynie 26 zł miesięcznie. Jako że millenialsi są bardzo mobilni i często zmieniają miejsce pobytu, pakiety można wyłączyć i tym samym zredukować wartość abonamentu do 0 zł. Później można zwiększać go wedle upodobań, bo smartfon bez internetu traci znaczą część swoich zastosowań. Millenialsi są zresztą mistrzami w ich wykorzystaniu, co widać w statystykach. 13 proc. Amerykanównie byłoby w stanie przeżyć bez niego godziny, a połowa miałaby trudności z przeżyciem dnia. Smartfon jest dla nich ważniejszy niż szczoteczka do zębów czy dezodorant, co nie dziwi, bo jest o wiele bardziej uniwersalny. Do tego stopnia, że co trzeci millenials zabiera go ze sobą do toalety, a 83 proc. kładzie obok łóżka, kiedy idzie spać. Millenialsi tworzą dla siebie nowy świat – elastycznych, dopasowanych do potrzeb usług, które nie wiążą na długie lata. Cenią przejrzystość, wygodę i intuicyjność, które pozwalają oszczędzić cenny czas. Choć w modzie jest krytykowanie millenialsów, to ja w ich rzeczywistości odnajduję się jak ryba w wodzie. Może dlatego, że jestem jednym z nich. Partnerem artykułu jest Virgin Mobile."
http://tech.wp.pl/kasety-wiecznie-zywe-na-allegro-sprzedaje-sie-ich-400-miesiecznie-ciagle-ukazuje-sie-na-nich-nowa-muzyka-6084019021509761a,"Kasety wiecznie żywe. Na Allegro sprzedaje się ich 400 miesięcznie, ciągle ukazuje się na nich nowa muzyka Zdziwiły was winyle w Biedronce? Myślicie, że słuchanie muzyki na czarnej płycie to zaskakująca moda? W takim razie nie zauważyliście powrotu kaset. A raczej umknął wam fakt, że te właściwie nigdy nie odeszły.  Tylko podczas ostatniego sezonu świątecznego sprzedaż kaset magnetofonowych wzrosła o 140 proc. w porównaniu z ubiegłym. Amerykańska wytwórnia i właściciel platformy streamującej muzykę, marka Bandcamp odnotowała w 2016 roku wzrost sprzedaży kaset o 46 proc. W tym samym czasie komercyjne ich powielanie u największego producenta wzrosło o 20 proc. - pisała niedawno Gadżetomania.  Wcale mnie to nie dziwi. Sam zacząłem zbierać kasety z nową (!) muzyką dwa - trzy lata temu. Dlaczego? Bo są śliczne.  To małe dzieła sztuki. Z przemyślanymi okładkami, imponującymi grafikami. Jasne, płyty winylowe też są piękne, można zachwycać się okładkami wydań CD. Jednak kasety ze względu na swój niewielki rozmiar mają zupełnie inny urok. Na dodatek można je inaczej zapakować - nie zawsze jest to tradycyjne, plastikowe pudełko.  Wydawcy i zespoły kombinują, bawią się formą, stylem. Warszawski zespół Guiding Lights wypuścił na przykład taką kasetę:  A wytwórnia Złe Litery taką:  Wydania kasetowe różnią się pudełkami - np.  album artysty o pseudonimie K. w wytwórni Jasień ukazał się w nietypowym, jakby “gumowym” opakowaniu. Tylko na pierwszy rzut oka wszystko jest ""jedno i to samo"". Każda kaseta jest inna.  Ma inny kolor. Jedna jest zielona, inna żółta; mam kasety przezroczyste, całe białe lub całe czarne. Jedna lepiej wygląda jak stoi, drugą przyjemniej oglądać postawioną na boku, kiedy okładka jest poziomo. Po prostu przyjemnie się na nie patrzy.  Wszystko w nich jest dokładnie zaplanowane. Bo współczesne, polskie kasety to nie dzieło fabryki (nie licząc rzecz jasna samej taśmy), a wydawca to nie normalna, prężna korporacja. Polskie niezależne wytwórnie, wypuszczające muzykę na kasetach, są przeciwieństwem wielkich firm. To najczęściej jednoosobowe projekty lub co najwyżej zajęcie dla niewielkiej grupki, które robią to po pracy, a nie z tego żyją. Nakłady też są więc niewielkie - tylko wybrane, nagrane przez “pewne” zespoły kasety ukazują się w 50 czy 100 egzemplarzach. Znacznie częściej to mniej niż 50 sztuk, raczej koło 20. I w tym też tkwi magia.  Podział jest prosty: najczęściej artysta nagrywa, a wydawca zajmuje się dystrybucją i wydawaniem. Czyli tworzeniem szaty graficznej, wkładaniem okładek i kaset do pudełek, wycinaniem grafik, przegrywaniem, pakowaniem, wysyłaniem, słowem - całą czarną robotą. Brzmi banalnie, ale kupując kasetę od razu wiem, że ""ma duszę"". Ktoś sam ją stworzył, musiał się namęczyć, zaplanować, wykonać. Dostajemy “produkt” wyjątkowy. Wykonany metodą chałupniczą, “zrób to sam” w każdym calu, i dlatego tak wartościowy.  A poza tym płacę za muzykę bezpośrednio artyście i wydawcy. W czasach, kiedy streaming jest bardzo wygodny i przydatny, ale przy tym staje się zwykłą usługą - często będącą dodatkiem do innej, na przykład przy abonamencie telefonicznym - kaseta pozwala po prostu nawiązać więź z artystą. Zapłacić mu za jego pracę, przyczynić się do tego, że wydawca dalej będzie chciał się męczyć. Widać to szczególnie na zachodzie, gdzie nawet początkujące zespoły wypuszczają swoje single na kasetach, winylowych “siódemkach”, tworzą koszulki, breloczki czy figurki i handlują nimi na koncertach. To sposób, by nie dokładać do interesu. I żeby słuchacz był zadowolony - miał coś namacalnego, coś więcej niż tylko bezstratny plik w chmurze czy na dysku.  Uczciwy układ - idę na koncert, płacę za bilet, słucham muzyki, która mnie interesuje, kupuję gadżety, wynagradzam twórcę za jego pracę. I przy tym mam coś z tego, mogę przypominać sobie występ na żywo patrząc na półkę i stos kaset.  Dlaczego kasety nie umarły? Od razu ciśnie się odpowiedź - bo są tanie. I rzeczywiście, z punktu widzenia kupującego to bardzo oszczędny cenowo nośnik. Nowa kaseta, premiera, u polskiego niezależnego wydawcy rzadko kiedy kosztuje więcej niż 20-25 zł. Jeśli wybieramy kasetę starą, używaną, zapłacimy jeszcze mniej. Ludzie sprzedają je za grosze, bo “komu dzisiaj potrzebna”, wielu już dawno nie ma ich na czym słuchać. Kasetę Kultu czy innego popularnego zespołu z lat osiemdziesiątych w serwisie aukcyjnym kupimy nawet za 5 zł.  Trochę inaczej wygląda to z perspektywy wydawcy. Czyste kasety trzeba ściągać z Wielkiej Brytanii, w Polsce dobrych fabryk nie ma. Wbrew pozorom nagranie albumu na kasetę nie jest dużo tańsze niż wydanie go na płycie CD. A nawet jakby było, to rodzime wytwórnie nie mogą liczyć na kokosy, skoro wypuszczają muzykę w niskim nakładzie. Chodzi o to, by wydać ciekawą rzecz, wyjść na zero lub ewentualnie mieć pieniądze na kolejny projekt. Czysta pasja, a więc kolejna rzecz, która sprawia, że kasety to coś wyjątkowego.  Bycie kolekcjonerem kaset jest naprawdę niedrogim hobby. Dziś kupno dobrego sprzętu, który pozwoli cieszyć się wyjątkowym, ciepłym brzmieniem kasety, nie zrujnuje domowego budżetu. Za niewielkie pieniądze można kupić odtwarzacze czy decki, które kilkanaście lat temu były piekielnie drogie. A poza tym wciąż ma się dostęp do plików cyfrowych. Kaseta wcale nie oznacza odwrócenia się plecami od dobrego dźwięku i nowych technologii. Idzie z nimi w parze.  To też jest ważne. Kasetę możemy potraktować jako gadżet, a słuchać jej na komputerze czy telefonie, w formie plików MP3. Możemy też odkurzyć starego walkmana albo kupić na Allegro stary, ale bardzo dobry magnetofon. ""Wkręcając"" się zaczniemy szukać jeszcze lepszych sprzętów, o których dawno temu marzyliśmy, a dziś możemy je mieć na wyciągnięcie ręki. Bo ktoś jednak postawił na muzykę cyfrową, nie ma miejsca w domu, chce się dawnego urządzenia grającego pozbyć.  Wiele osób twierdzi, że kupowanie kaset to głupia moda, bo dźwięk jest niedoskonały. Fanaberia dla osób, które odrzucają nowinki technologiczne, udają alternatywnych, bo wracają do sprzętów retro. To nie tak. Raczej nikt, kto zbiera kasety, nie wyrzucił odtwarzacza CD i nie odciął się internetu, by słuchać muzyki z kaset, za pomocą magnetofonu.  Kupując kasetę, automatycznie dostaje się cyfrowe pliki do pobrania np. z Bandcampa. Poza tym niedoskonałość kasety jest często celowo wykorzystywana. Sami wydawcy przyznają, że nie każdy album może ukazać się na kasecie. Czasami płyta CD jest lepsza, czasami kaseta. Polskie wytwórnie, które najchętniej sięgają po ten nośnik, wydają w końcu muzykę eksperymentalną. Są to nagrania terenowe, ciężkie drony, ambient, noise - gatunek, w którym im brzydziej, im niedoskonalej, tym lepiej - czy tak nietypowe eksperymenty jak… nagrania zmywarki. W takiej muzyce idealne, perfekcyjne brzmienie schodzi na dalszy plan, więc kaseta jest idealna dla takich dźwięków.  Wszyscy wiedzą, że kasety są niedoskonałe, więc ""środowisko kasetowe"" traktuje je zwyczajnie, jako pasję i hobby, a nie ""styl życia"". Różnice widać, gdy zajrzy się na fora dla słuchaczy płyt winylowych. Tam każda wada nośnika jest wypunktowana, na cyfrowe pliki patrzy się z pogardą, a dobra muzyka to tylko albumy nagrane przed rokiem 1989 rokiem. Przy kasetach jest inaczej - owszem, to sympatyczny nośnik, można go lubić, ale też nie ma w tym wielkiej, muzycznej ideologii. Same wytwórnie są też bardzo otwarte, bo wiedzą, że tworzą dla nielicznej grupy, więc mogą sobie pozwolić na eksperymenty. Wydają więc freejazz, metal czy elektronikę. Robią, co chcą, wypuszczają przyjemne dla oka gadżety, nie martwiąc się, czy audiofile będą zadowoleni.  O kasetach pamiętają też ci, którzy słuchali muzyki w ten sposób lata temu. Obecnie na Allegro sprzedaje się od 300 do 400 kaset miesięcznie. Często taka kaseta ma sporą wartość kolekcjonerską, bo od dawna nie ma jej na rynku. Albo została wydana przez pirata, w niewielkim nakładzie, więc to jeszcze większy unikat. Kolekcjonerzy chcą mieć takie perełki i słono za nie płacą. Za 12 kaset Kultu, wśród których są nagrania z koncertów, trzeba zapłacić 600 zł. 60 sztuk metalowych kapel wyceniono na 1200 zł, a pierwsze oryginalne wydania hip-hopowych składów to wydatek nawet 250 zł.  O tym, że pogłoski o śmierci kaset były mocno przesadzone, świadczą nie tylko wyniki ze Stanów Zjednoczonych. W Polsce od lat, w muzycznym podziemiu, kasety są normalnym nośnikiem, na którym wydaje się nową muzykę. Nie ma tu mowy o nostalgii i sentymencie, skoro chodzi o premierowe nagrania. Dziś mamy co najmniej kilkanaście niezależnych wytwórni, które wypuszczają albumy swoich artystów właśnie w ten sposób. Do najważniejszych możemy zaliczyć BDTA, Jasień, Pointless Geometry, DUNNO Recordings, Pionierska Records, Złe Litery czy Wounded Knife, które niedawno zakończyło swoją działalność pod tą nazwą. Nie ma mowy o renesansie kaset, bo te tak naprawdę nigdy nie umarły. Raczej przerodziły się w niszę. Czy znowu staną się ogólnodostępne, tak jak winyle? Trafią do Biedronki? Raczej nie, ze względu na to, że nie kojarzą się z audiofilskimi doznaniami. Ale też nie czeka ich smutny koniec, to nie chwilowa moda. Od kiedy sam zacząłem zbierać kasety 2-3 lata temu, powstają kolejne wytwórnie, targi niezależnych wydawców wciąż cieszą się popularnością, premier nie brakuje, a nowych odbiorców przybywa. To wyjątkowa nisza, na którą warto zwrócić uwagę."
http://tech.wp.pl/polacy-kochaja-disco-polo-i-internet-jest-tego-dowodem-ale-wiekszosc-wciaz-sie-tego-wstydzi-6086826112344705a,"Polacy kochają disco polo i internet jest tego dowodem. Ale większość wciąż się tego wstydzi Disco polo za sprawą Telewizji Polskiej powróciło na salony. Zenek Martyniuk śpiewał w sylwestrową noc w czasie koncertu transmitowanego przez TVP, wkrótce na antenie stacji mają pojawić się programy poświęcone temu gatunkowi. Powrót mody na przaśne piosenki? Jaki powrót, skoro disco polo od lat święci triumfy w sieci. Internet i disco polo to dobre połączenie, czego dowodem jest zespół... E-maill. Drugim polskim najpopularniejszym teledyskiem na “polskim YouTubie” w 2016 roku była oczywiście piosenka disco polo zgrupy Power Play - ""Lubisz to lubisz” z liczbą prawie 30 mln wyświetleń. Ale dominację tego gatunku najlepiej pokazuje zestawienie podsumowujące dziesięć lat obecności serwisu na polskim rynku. Wiecie, jaki materiał oglądano przez tę dekadę najczęściej?  Właśnie ten: Dodajmy, że choć YouTube istnieje od 2005 roku, to premierę “Ona tańczy dla mnie” mieliśmy w… 2012.  Gwiazdy disco polo są też w zestawieniach najpopularniejszych wyszukiwanych haseł. Jak to się stało, że gatunek kojarzony z latami dziewięćdziesiątymi, przasnością, prostotą i siłą rzeczy z nienowoczesnością, podbił internet, tak jak wcześniej stragany z kasetami i płytami CD?  Bo wbrew pozorom artyści disco polo bardzo szybko internet zrozumieli. Dziś wielu muzycznych ekspertów zachwyca się, że polscy wykonawcy dostrzegają problemy związane z internetem. Muzycy robią z siebie przestrzegających przed niebezpieczeństwem sieci czy nowych technologii mędrców, podczas gdy gwiazdy disco polo nie dość, że o nowinkach technologicznych śpiewały dawno temu, to jeszcze sensownie. Ot, radosne utwory o tym, czym żyła Polska - Nasza Klasa czy SMS-y były głównymi tematami utworów. Powstał nawet zespół Skaner czy E-maill, a niektórzy wykonawcy stylizowali się na bohaterów Matriksa, biorąc z nowych technologii i podobnych klimatów to, co popularne, ciekawe i najlepsze. Bez zbędnego moralizatorstwa.  Osoby zajmujące się disco polo nie tylko podążały za modą i technologicznym rozwojem, ale potrafiły zrobić z niego użytek. Zespół Weekend, autorzy hitu “Ona tańczy dla mnie”, już w 2013 roku tylko przez miesiąc zarobili ponad sto tysięcy złotych w samych kanałach cyfrowych! Czyli za pośrednictwem serwisów internetowych, muzyki z chmury czy usług typu “Granie na czekanie”.  Do dziś trwają dyskusje, czy streaming zabija muzykę, czy może jej pomaga, a prawie cztery lata temu disco polo nic sobie z tych rozważań nie robiło, tylko po prostu zarabiało. Wykorzystując wszelkie nowe sposoby, które pozwalały dotrzeć do fanów. Ludzie nie kupują płyt? Żaden problem, będziemy w sieci, wykorzystując nowe modele dystrybucji. Wiedza, której do dziś nie mogą przyswoić zapomniane gwiazdy estrady, w 2013 była dla disco polo oczywistością.  Kiedy w 2015 roku eksperci od kultury wraz z muzykami disco polo po raz setny - choć tym razem mając powód, jakim był sukces filmu “Disco polo” - zastanawiali się, czy ten gatunek jest wartościowy czy obciachowy, discopolowe hity były niemal wszędzie. Nie w mainstreamowych stacjach, ale za to w internecie, internetowych radiach czy nawet w grach. W “Singstar: Mistrzowska impreza” przeboju “ Ona tańczy dla mnie” zabraknąć oczywiście nie mogło. Nie rock, nie wielbiony na świecie polski metal, nawet nie pop, a nasze swojskie disco polo “sprzedawało” grę karaoke - czy może być lepszy dowód na to, że disco polo świetnie odnalazło się w nowych czasach i na to, że nigdy nie przestało rządzić gustem Polaków? Sukces disco polo kojarzy nam się z latami dziewięćdziesiątymi, straganami, kasetami czy pierwszymi kompaktami. Tymczasem internet to nowe kanały dystrybucji, łatwiejsza droga do fanów. Nie zmieniło się jednak jedno: wciąż słuchanie disco polo to coś, do czego niezbyt chętnie Polacy się przyznają.  Na YouTubie rządzi disco polo, ale już na Facebooku gwiazdy gatunku taką popularnością się nie cieszą. W TOP 10 profili celebrytów jest np. Kamil Bednarek czy Cleo, a nie ma artystów disco. Zespół Weekend, najpopularniejszy na YouTubie, ma raptem niecałe 185 tysięcy polubień! VOX FM, stacja radiowa skupiająca się na muzyce disco polo, która z roku na rok zwiększa swoje udziały rynkowe (a w okresie od sierpnia do października 2016 roku zanotowała największy wzrost słuchalności, o czym informował portal Wirtualne Media), też nie jest w TOP 10 profili “mediowych”, przegrywając np. z Eską czy RMF FM. Mało tego - nie jest nawet w dziesiątce najpopularniejszych rozgłośni. Podobnie jest z kanałem Polo TV, które jest liderem stacji muzycznych w Polsce, ale na Faceooku udział ma niewielki.  Ba, ze statystyk wynika, że VOX FM pod względem zaangażowania fanów zajmuje dopiero siódme miejsce. O czym to świadczy? Polacy słuchają disco polo, ale nie chcą się do tego przyznać. Anonimowo nabija się artystom wyświetlenia, komentuje hity, ale na Facebooku, pod nazwiskiem, kiedy znajomi mogą zobaczyć - lepiej nie być z disco polo kojarzonym. “Niby nikt nie słucha, a teksty piosenek zna każdy” - to popularne powiedzonko najlepiej opisuje ten gatunek w internecie.  Internet dał disco polo nowe metody dotarcia do słuchaczy, pozwolił podtrzymać popularność tej muzyki, ale nie wyleczył jednego z największych polskich kompleksów - wstydu przed disco polo. Ten paradoks w sieci jest szczególnie widoczny - piosenki disco polo rządzą, ale mało kto przyznaje się, że to jego zasługa."
