links,bodies
http://teleshow.wp.pl/shanon-purser-o-swojej-seksualnosci-to-dobra-pora-zeby-sie-otworzyc-6114418119551105a,"Shanon Purser o swojej seksualności: ""To dobra pora, żeby się otworzyć"" Shanon Purser zdecydowała się przyznać fanom do swojej seksualności. 19-latka zdobyła się na sporą odwagę.  Shanon Purser, znana widzom jako Barb z bijącego rekordy popularności serialu ""Stranger Things""  chętnie pokazuje się na imprezach towarzyskich. Jest także aktywna na Instagramie i Twitterze. Ostatnio postanowiła zdobyć się na odważne wyznanie. Młoda aktorka wyznała publicznie, że jest biseksualna.  - Zwykle tego nie robię, ale teraz jest dobra pora, żeby się otworzyć. Ostatnio przyznałam się, że jestem biseksualna tylko mojej rodzinie i przyjaciołom – napisała w poście.  - To coś, nad czym wciąż pracuję i wciąż próbuję zrozumieć. Nie lubię o tym za dużo mówić, jestem nowa w społeczności LGBT – dodała."
http://teleshow.wp.pl/gra-o-tron-opublikowano-pierwsze-oficjalne-zdjecia-7-sezonu-6114338869552769a,"""Gra o tron"" - opublikowano pierwsze oficjalne zdjęcia 7. sezonu Premiera 7. sezonu ""Gry o tron"" coraz bliżej. W sieci pojawiły się właśnie pierwsze oficjalne zdjęcia zapowiadające najnowsze odcinki serialu. Fotografie przedstawiają bohaterów, którzy prawdopodobnie odegrają kluczowe role w nadchodzących wydarzeniach. Fani ""Gry o tron"" odliczają dni do premiery 7. sezonu serialu. Produkcja powróci na ekrany 16 lipca i do tego czasu widzom muszą wystarczyć pojawiające systematycznie w mediach materiały zapowiadające najnowszą serię. HBO pokazało właśnie fotografie z planu zdjęciowego nadchodzącej odsłony ""Gry o tron"". Zdjęcia ukazują m.in. Cersei, Tyriona Lannistera, Jona Snowa, Aryę, Sansę, Brana, Lyannę Mormont, Littlefingera, Missandei oraz Daenerys. To pierwsza tak pokaźna galeria zdjęć opublikowana przez producentów serialu.  Przypomnijmy, że premiera ""Gry o tron"" została przesunięta na lipiec ze względu na warunki pogodowe. Twórcy musieli opóźnić rozpoczęcie zdjęć, by dopasować się do aury panującej w Westeros. Najnowszy sezon ""Gry o tron"" powstawał w Irlandii Północnej, Hiszpanii oraz Islandii.  Siódmy sezon ""Gry o tron"" będzie krótszy od poprzednich części. Twórcy zapowiedzieli, że liczyć on będzie jedynie 7 epizodów. Fabuła kolejnej odsłony serialu trzymana jest w ścisłej tajemnicy. Wiadomo, że widzowie mogą spodziewać się spotkania Jona Snowa z Daenerys, co może mieć znaczący wpływ na dalsze losy Północy. W rolach głównych ponownie zobaczymy Emilę Clarke, Lenę Headey, Kita Haringtona, Sophie Turner oraz Maisie Williams. W obsadzie serialu znalazł się także Ed Sheeran.   Tutaj sprawdzisz aktualną ramówkę Telewizji WP  Tu pobierzesz za darmo aplikację Program TV:"
http://teleshow.wp.pl/marvels-cloak-and-dagger-z-pierwszym-zwiastunem-6114085793883777a,"""Marvel''s Cloak and Dagger"" z pierwszym zwiastunem Producenci przedstawili pierwszy zwiastun serialu ""Marvel''s Cloak and Dagger"", który opowiadać będzie o romansujących superbohaterach. Zobaczcie sami! Trailer przedstawia nastoletnich bohaterów w kilku różnych życiowych sytuacjach - typowo rodzinnych, ale i dramatycznych. Jest tu kłótnia, niebezpieczny wypadek samochodowy oraz broń. Produkcja opisywana jest jako love story w świecie superherosów. Głównymi bohaterami będą nastolatkowie Cloak i Dagger - czyli Tandy Bowen (w tej roli Olivia Holt) i Tyrone Johnson (gra go Aubrey Joseph) - para znana z wielu wydawnictw Marvel Comics, w tym opowieści o Spidermanie i X-Menach. Cloak i Dagger pochodzą z bardzo różnych środowisk i przyzwyczajają się dopiero do panowania nad swoimi mocami (Tandy może rzucać świetlnymi sztyletami, a Tyrone - zalewać innych ciemnością). Dzieciaki zakochują się w sobie, co jeszcze bardziej komplikuje im życie. W obsadzie znaleźli się również Andrea Roth, Gloria Reuben, Miles Mussenden, Carl Lundstedt, James Saito i J.D. Evermore. Odcinek pilotażowy wyreżyserowała Gina Prince-Bythewood. Funkcję showrunnera sprawuje Joe Pokaski. W realizację serialu zaangażowane będą również Marvel Studios i ABC Signature Studios. Na razie wiadomo, że powstanie jeden sezon liczący 10 odcinków. Premiera zapowiedziana została na początek 2018 roku.Zobaczcie zwiastun:"
http://teleshow.wp.pl/krypton-poznajcie-dziadka-supermana-6113748445709953a,"""Krypton"": Poznajcie dziadka Supermana Pod koniec roku na antenie Syfy pojawi się nowy serial opowiadający o dziadku Supermana - ""Krypton"". Akcja rozgrywa się dwa pokolenia przed wydarzeniami z obrazu ""Człowiek ze stali"". Bohaterem będzie dziadek Supermana, Seg-El (w tej roli Cameron Cuffe), który próbuje ocalić honor rodziny i swój świat. - Kal-Elu, mój przyszły wnuku - mówi Seg-Ela. - Nim usłyszysz te słowa, miejsce, gdzie przyszedłeś na świat będzie odległym wspomnieniem.  Twórcą cyklu jest David S. Goyer. W głównej roli kobiecej występuje Georgina Campbell jako Lyta Zod, krewna generała Zoda, przyszłego wroga Supermana. Premiera planowana jest jeszcze w tym roku."
http://teleshow.wp.pl/born-to-kill-tak-wygladaja-narodziny-psychopaty-widzowie-sa-na-to-gotowi-6113390959655041a,"""Born To Kill"": tak wyglądają narodziny psychopaty? Widzowie są na to gotowi? Stacja Channel 4 na 20 kwietnia wyznaczyła premierę nowej miniserii ""Born To Kill"". Bohaterem będzie Sam, z pozoru przeciętny nastolatek. Chłopak jednak czuje, że dzieje się z nim coś nie tak i próbuje stłamsić swoje psychopatyczne zapędy. Cykl, składający się z 4 odcinków, ma poruszać podobne problemy, co dramat ""Musimy porozmawiać o Kevinie"" z Tildą Swinton w roli głównej. W obsadzie znaleźli się: Romola Garai, Daniel Mays, Jack Rowan, Lara Peake, Elizabeth Counsell, Richard Coyle. Scenariusz napisały Tracey Malone (""Rillington Place"") i Kate Ashfield. Poniżej prezentujemy zwiastun serialu:  Tutaj sprawdzisz aktualną ramówkę Telewizji WP  Tu pobierzesz za darmo aplikację Program TV:"
http://teleshow.wp.pl/magda-gessler-znow-odniosla-sukces-dokument-z-jej-udzialem-nagrodzony-6115426431035009a,"Magda Gessler znów odniosła sukces. Dokument z jej udziałem nagrodzony  ""Pyszne Peru"", dokument z udziałem Magdy Gessler przypadł do gustu nie tylko widzom. Został nagrodzony na festiwalu w Hamburgu.  W dokumencie pokazano jak popularna restauratorka Magda Gessler wędruje po peruwiańskich targach poznając miejscową kulturę, przygotowuje lokalne dania oraz prezentuje miejscowe przyprawy i kulinaria. Ekipa filmowa będąc w Peru zrealizowała także inny materiał o problemach tamtejszych mieszkańców, pt. ""Hisotrie więzienne"". Film został wyemitowany jesienią na antenie TVN Style. Dokument został nagrodzony na tegorocznej edycji World Media Festival w Hamburgu. Członkowie jury przyznali ekipie TVN i Małgorzacie Łupinie nagrodę Srebrnego Globu. Łupina (zastępca dyrektora programowego TVN ds. kanałów tematycznych) jest już kilkukrotną laureatką konkursu. Na World Media Festival otrzymała już Srebrny Glob za dokument ""Obsesja doskonałości"" z Marcinem Prokopem i Grand Prix 2015 dla filmu ""Trzy na godzinę"" z Anną Dereszowską.  Tutaj sprawdzisz aktualną ramówkę Telewizji WP  Tu pobierzesz za darmo aplikację Program TV:  Zobacz także: Magda Gessler była w niebezpieczeństwie w Meksyku: Ostrzegł nas konsul"
http://teleshow.wp.pl/ucho-prezesa-13-odcinek-juz-dostepny-na-youtube-opozycja-w-gabinecie-przy-nowogrodzkiej-6115407395088001a,"""Ucho Prezesa"" – 13. odcinek już dostępny na Youtube. Opozycja w gabinecie przy Nowogrodzkiej 13. odcinek ""Ucha Prezesa"" pojawił się już na Youtube. Tym razem wizytę głównemu bohaterowi składają członkowie opozycji. Wśród nich jest m.in. Grzegorz Schetyna nazywany ""Ancymonem z Platformy"". Co jeszcze ciekawego dzieje w gabinecie w najnowszej odsłonie serialu? ""Ucho Prezesa"" powraca po świątecznej przerwie. 13. odcinek bijącego rekordy popularności serialu internetowego właśnie został opublikowany na Youtube. Tym razem do gabinetu głównego bohatera przybywają przedstawiciele ugrupowań opozycyjnych. W konspiracyjnej atmosferze politycy snują m.in. plany obalenia Donalda, który właśnie został wybrany na szefa Rady Europejskiej. Przypomnijmy, że w poprzednim epizodzie były premier zadzwonił do tytułowego prezesa i przekazał mu życzliwe pozdrowienia. Lider partii rządzącej wpadł w szał po rozmowie z Donaldem i zaprzysiągł mu, że jeszcze się z nim policzy. Wygląda na to, że prezes zaczyna właśnie wcielać swój plan w życie. Najnowszy odcinek ""Ucha Prezesa"" zaczyna się od przybycia na Nowogrodzką Grzegorza Schetyny. Pojawienie się ""Ancymona z Platformy"" wyraźnie szokuje Panią Basię i przebywającego w poczekalni prezydenta. Mariusz przypomina przybyłemu politykowi, że jego spotkanie z prezesem jest ściśle tajne. Grzegorz chce wejść w układ z partią rządzącą. Wszystko po to, by zapobiec powrotowi do kraju Donalda Tuska.  - Ja trochę panu zrobię dobrze. I pan mnie też trochę zrobi... – proponuje prezesowi przewodniczący Platformy. Prezes nie jest jednak przekonany, czy układ z Grzegorzem wyjdzie mu na dobre. Główny bohater rozmyśla, czy lepiej nie byłoby zawiązać sojuszu z Ryszardem Petru: - Jaki Rysiek? On tylko wam wstydu przyniesie – kwituje ten pomysł Grzegorz – Przecież on obchodzi Święto Sześciu Króli!
- Ja to bym chętnie posłuchał, jak on rozmawia z tym naszym San Escobarem – dodaje obecny przy rozmowie Mariusz. Do gabinetu przychodzą kolejni politycy opozycyjnych partii. Wśród nich jest wspomniany Ryszard Petru, który już na wstępie proponuje Pani Basi przewalutowanie kredytu. Bohater wydaje się bardzo elokwentny, jednak przekręca on każde możliwe porzekadło, co oczywiście wyśmiewa wrogo nastawiony do niego Schetyna. To jednak nie koniec gości przy Nowogrodzkiej. Do prezesa przybywa lider PSL, który namawia prezydenta do zmiany godła. Kolejno po nim głównego bohatera odwiedzają Paweł Kukiz, który nie szczędzi każdemu ostrych słów krytyki, Joanna Schmidt, która proponuje Ryszardowi kolejną wycieczkę oraz poseł Liroy z ""leczniczymi cudownymi papieroskami"". W gabinecie dochodzi do awantury, co wyraźnie cieszy prezesa. Jego plan skłócenia opozycji zostaje zrealizowany. W najnowszym odcinku ""Ucha Prezesa"" wystąpili tradycyjnie Robert Górski, Mikołaj Cieślak, Izabela Dąborwska i Paweł Koślik. Gościnnie pojawili się także Tomasz Sapryk, Lesław Żurek, Bartłomiej Magdziarz, Wojciech Mecwaldowski, Jan Aleksandrowicz oraz Paulina Holtz. Następny odcinek ""Ucha Prezesa"" będzie mieć swoją premierę w czwartek 27 maja na platformie ShowMax. 14. epiozd pojawi się na Youtube w następny poniedziałek. Będzie to jednocześnie ostatnia odsłona, która zostanie opublikowana na tym serwisie. Dwa ostatnie odcinki serii dostępne będą tylko dla użytkowników ShowMax."
http://teleshow.wp.pl/polsat-juz-nie-chce-karoliny-szostak-nic-bardziej-mylnego-6115402825602689a,"Polsat już nie chce Karoliny Szostak? Nic bardziej mylnego Krolina Szostak straci pracę? Wręcz przeciwnie. Prawdopodobnie dostanie własny program!  Dziennikarka zniknęła z anteny – oficjalnie przebywa na urlopie do 25 maja. Szybko zaczęto plotkować o tym, że straci pracę w stacji, a zastąpi ją Paulina Chylewska. Okazało się to jednak nieprawdą, choć, jak poinformowało „Party”, została zawieszona w obowiązkach na trzy miesiące. Niebawem ma wrócić do pracy. - Karolina nie rezygnuje z pracy w Polsacie ani nie została z tej stacji wyrzucona. Podobno ma wrócić na antenę pod koniec maja – wyjawił informator „Party”. – Jest często widywana w Polsacie. Plotkuje się, że pracuje nad tajnym projektem dla stacji, który ma łączyć jej dwie pasje: tematykę lifestyle’ową ze sportową – dodał. Co więcej, dziennikarka nagrywa DVD z ćwiczeniami dla kobiet, które nigdy nie uprawiały sportu i zaczyna prace nad nową książką. Dodatkowo nie brakuje jej propozycji prowadzenia eventów czy reklamowania kosmetyków i suplementów diety. Tym chyba już na dobre utrze nosa hejterom, którzy wróżyli jej, że dopadnie ją efekt jo-jo. Ona jednak utrzymuje szczupłą figurę i nienaganny wygląd, a swoje urodowe triki chce zdradzić czytelniczkom w książce. – Na pewno znajdą się w niej kolejne zdrowe przepisy i porady modowo-urodowe. Reszta to niespodzianka! – podsumował informator.   Tutaj sprawdzisz aktualną ramówkę Telewizji WP  Tu pobierzesz za darmo aplikację Program TV:  Zobacz także: Karolina Szostak o swojej książce. ""To nie będą rady dla wszystkich"""
http://teleshow.wp.pl/m-jak-milosc-bez-witolda-pyrkosza-co-czeka-uwielbiana-przez-widzow-postac-lucjana-mostowiaka-6115424337848449a,"""M jak miłość"" bez Witolda Pyrkosza. Co czeka uwielbianą przez widzów postać Lucjana Mostowiaka? Aktor przed śmiercią przewidział losy granego przez siebie bohatera. Co zdradził w jednym z wywiadów? Witold Pyrkosz był uwielbiany przez widzów szczególnie za telewizyjne role, których nie brakowało w jego dorobku. Ogromną rozpoznawalność zyskał dzięki grze m.in. w serialach ""Czterej pancerni i pies"" i ""Janosik"". W ostatnim czasie zainteresowanie widzów zapewniła mu rola nestora rodu Mostowiaków w ""M jak miłość"". W tę postać wcielał się przez 17 lat. Kilka miesięcy przed śmiercią podzielił się refleksją, jak jego zdaniem potoczą się dalsze losy Lucjana. - Ze scenariusza czytam tylko swoje role. Na planie ""M jak miłość"" wszyscy przyzwyczaili się już do tego. Bo niby po co mam to czytać? Co to za literatura? Za chwilę i tak Lucjan zginie, albo umrze śmiercią naturalną i odbędzie się piękny pogrzeb, a życie innych bohaterów i tak będzie się dalej toczyć. Nie potrafię wyobrazić sobie ""M jak miłość"" beze mnie, ale zdaję sobie sprawę z tego, że niestety ta chwila kiedyś nastąpi. Podejrzewam, że serial będzie kręcony jeszcze przez dobrych kilkadziesiąt lat, a mi nie pozostało tyle czasu - stwierdził Pyrkosz w niedawnej rozmowie z tygodnikiem ""Świat i Ludzie"". Co na to twórcy ""M jak miłość""?  - Decyzje dopiero zapadają z takiego względu, że scenariusze były gotowe przed tradycyjną dłuższą przerwą wiosenną pracy ekipy i nikt się nie spodziewał, że aktor nie wróci już na plan. Produkcja od dłuższego czasu zdawała sobie sprawę, że musi się przygotowywać na tę smutną ewentualność. Pan Pyrkosz miał problemy ze zdrowiem, musiał odpoczywać miedzy ujęciami, pojawiały się kłopoty z zapamiętywaniem tekstu, więc często skracano jego wypowiedzi. Oczywiście była to bardzo smutna informacji dla wszystkich na planie, ale trudno powiedzieć, że zaskakująca - zdradziła w rozmowie z WP Teleshow osoba związana z produkcją. - Dyskusje na temat wyprowadzenia wątku ze scenariusza jeszcze trwają, ale scenarzyści od jakiegoś czasu rozmyślali nad ""uśmierceniem"" Lucjana. On sam zresztą zdawał sobie z tego sprawę - dodał nasz informator. Przypomnijmy, że Pyrkosz zmarł w miniony weekend. Jego śmierć była sporym szokiem dla fanów i środowiska artystycznego. Mimo że skończył 90 lat, wciąż tryskał energią i zarażał innych dobrym humorem. Niestety nieoczekiwanie pokonało go zapalenie płuc. Wyobrażacie sobie kolejne odcinki popularnego serialu bez jednej z najbardziej charyzmatycznych i charakterystycznych postaci?  Tutaj sprawdzisz aktualną ramówkę Telewizji WP  Tu pobierzesz za darmo aplikację Program TV:"
http://teleshow.wp.pl/nieudana-reanimacja-daleko-od-noszy-znika-z-anteny-6115378595399809a,"Nieudana reanimacja? ""Daleko od noszy"" znika z anteny Niedawno do ramówki Polsatu powróciło ""Daleko od noszy"". W odświeżonej formule, z nowymi postaciami. Serial jednak się nie utrzymał i znika z ekranów.  ""Daleko od noszy"" powróciło na antenę Polsatu 4 marca. Można go oglądać w sobotnie popołudnia o 16.15. Emisja serialu, jak poinformował portal wirtualnemedia.pl, skończy się po 9 odcinkach (a cała seria liczy 12).  Jak można się domyślić, decyzja była podyktowana tym, że sitcom nie miał zadowalającej Polsat oglądalności. Śledziło go średnio około 471 tys. widzów. Stacja nie skomentowała jednak zdjęcia tytułu z anteny. Po raz ostatni produkcja wyemitowana zostanie 29 kwietnia, a od 6 maja w tym paśmie stacja pokazywać będzie powtórki ""Kabaretu na żywo"". Nie wiadomo jeszcze także, czy wyemituje pozostałe odcinki przerwanej serii.  ""Daleko od noszy. Reanimacja"" to kontynuacja popularnej produkcji w prześmiewczy sposób pokazującej pracę w służbie zdrowia. Akcja serialu dzieje się w fikcyjnym szpitalu w Warszawie. Wcześniej sitcom na antenie Polsatu był emitowany od grudnia 2003 do stycznia 2009 roku, a potem od 2010 do 2011 roku.  Obecnie oprócz stałej obsady, m.in. Hanny Śleszyńskiej, Piotra Gąssowskiego czy Pawła Wawrzeckiego pojawiły się nowe postaci – jedną z pielęgniarek zagrała Katarzyna Glinka, a kierowcę karetki – Doda. Jak jednak widać, nawet obecność ponętnej i charyzmatycznej wokalistki nie zdołała na nowo przyciągnąć widzów i zachęcić do oglądania serialu.   Tutaj sprawdzisz aktualną ramówkę Telewizji WP  Tu pobierzesz za darmo aplikację Program TV:  Zobacz także: Doda szaleje karetką w centrum Warszawy. Zobacz zabawne wideo z szaloną gwiazdą!"
http://teleshow.wp.pl/joanna-koroniewska-i-katarzyna-glinka-walka-o-role-w-daleko-od-noszy-odbije-sie-na-ich-przyjazni-6115185351415425a,"Joanna Koroniewska i Katarzyna Glinka: walka o role w ""Daleko od noszy"" odbije się na ich przyjaźni? Obie aktorki liczyły na to, że uzyskają angaż do serialu. Glinka otrzymała rolę, Koroniewska, choć w produkcji pojawiała się wcześniej, nie dostała propozycji pracy.  - Joasia od dawna nie pojawiała się w telewizji. Gdy dowiedziała się, że wraca serial, w którym grała mecenas Alicję, cieszyła się, że będzie mogła przypomnieć się widzom - zdradził ""Faktowi"" znajomy Koroniewskiej. Niestety, okazało się, że plan na nową odsłonę sitcomu jest inny niż sądziła aktorka. Szybko stało się jasne, że nie było w nim miejsca dla Koroniewskiej.  Twórca ""Daleko od noszy"", Krzysztof Jaroszyński, opowiedział ""Faktowi"" o tym, co miało wpływ na jego decyzję.  - Nie było rozmów na temat przywrócenia Joasi Koroniewskiej do obsady. Miałem w głowie nową konstrukcję serialu. Dołączyła do niego już Kasia Glinka, a to nie jest produkcja, w której może zagrać wiele osób jednocześnie. I dodał: - Wątek z Joasią trzeba więc uznać za wygaszony. Wygląda na to, że niemal 39-letnia gwiazda będzie musiała poszukać innej szansy na powrót do kariery. Gwiazda jest piękna i utalentowana, więc nie powinna mieć problemu ze znalezieniem ciekawej pracy. Ostatnio wzięła udział w kampanii ""Giżycko MÓWI NIE dla Hejtu"". - Joasia stara się nie dopuszczać do siebie zazdrości o sukces Kasi, ale nie jest to dla niej łatwe - zdradził ""Faktowi"" znajomy Koroniewskiej.  Powiedział też, że Glinka rozstała się z mężczyzną, z którym zeswatała ją koleżanka. - Joasia była niepocieszona, że ten związek się rozpadł. Próbowała przekonać Kasię, by doceniła opiekuńczość Jarka, który ze stoickim spokojem znosił jej humory, ale się nie udało - wyjaśnił informator.  Koroniewska i Glinka znają się od lat. Zaprzyjaźniły się podczas studiów w łódzkiej szkole filmowej. Czy problemy dotyczące pracy zawodowej są w stanie zaszkodzić ich relacji?  Tutaj znajdziesz aktualny program tv! Tu pobierzesz za darmo aplikację Program TV:"
http://teleshow.wp.pl/dominika-gwit-poprowadzi-program-curvy-supermodel-6115479309125249a,"Dominika Gwit poprowadzi program ""Curvy Supermodel"" Przez wiele miesięcy Dominika Gwit była częstym tematem tabloidów. Wszystko za sprawą walki z nadwagą. Restrykcyjna dieta, ćwiczenia i silna wola doprowadziły do tego, że aktorka zrzuciła kilkadziesiąt kilogramów. Niestety po dawnej wadze nie ma już śladu. Za to jako symbol walki z otyłością Dominika zostanie prowadzącą nowego show Polsatu. Obecnie Gwit bierze udział w ""Tańcu z Gwiazdami"" i radzi sobie całkiem nieźle. Choć nie jest filigranowa i drobna jak tancerki i pozostałe uczestniczki, to skradła serca publiczności. Jak się okazuje również producenci Polsatu dostrzegli w niej ogromny potencjał i wartość reklamową.  Jak podaje ""Super Express"", Dominika została wybrana na prowadzącą ""Curvy Supermodel"". Nowy program stacji już zapowiadany jest jako absolutny hit. Uczestniczkami programu mają być modelki plus size, które pragną pracować w świecie modelingu.  W jury programu zasiądzie m.in. Zygmunt Chajzer, który bardzo kibicuje Dominice Gwit. - Jestem pod wrażeniem tego, co robi na parkiecie! Tego typu osoby dodają otuchy i odwagi tym, którzy czują się dyskryminowani przez to, ile ważą - powiedział w rozmowie z tabloidem. Tu bezpłatnie pobierzesz aplikację Program TV"
http://teleshow.wp.pl/pierwsza-milosc-odc-2487-radek-pomoze-arturowi-namierzyc-hakera-6115459593967233a,"""Pierwsza miłość"" odc. 2487: Radek pomoże Arturowi namierzyć hakera  Już 24 kwietnia wyemitowany zostanie kolejny odcinek ""Pierwszej miłości"". Akcja ponownie skupi się na problemach Artura, który za wszelką cenę będzie chciał namierzyć, kto wkradł się do bazy danych jego firmy. Bohaterowi z pomocą przyjdzie Radek. Co jeszcze wydarzy się w najnowszej odsłonie ""Pierwszej miłości""? Nad firmą Artura Kulczyckiego od dłuższego czasu utrzymują się czarne chmury. Aleksander wraz ze swoim ojcem wcielili w życie plan, który miał doprowadzić do upadku korporacji. Zbieg różnych okoliczności sprawił jednak, że Olek postanowił wycofać się z procederu. Wcześniej ukradł on jednak cenne informacje ze strzeżonej bazy danych przedsiębiorstwa Kulczyckiego. Artur odkrył, że ktoś niepowołany włamał się do systemu. Bohaterowi zależy, by jak najszybciej dopaść hakera i uratować firmę przed bankructwem. Czy Kulczycki odkryje wreszcie, kto stoi za kradzieżą danych? Zobacz zapowiedź 2487. odcinka ""Pierwszej miłości"". Artur nie wie, w jaki sposób ma znaleźć osobę odpowiedzialną za kradzież danych z firmowej bazy. Bohater czuje się bezradny, tym bardziej, że policja nie chce mu pomóc. Biznesmen domyśla się, kto stoi za włamaniem się do systemu korporacji. Artur potrzebuje jednak twardych dowodów na winę podejrzanego. Kulczycki wpada na pomysł, by Radek pomógł mu namierzyć hakera. Zieliński doskonale zna środowisko cyberprzestępców. Chłopak ochoczo zabierze się do poszukiwania sprawcy. Sabina cały czas będzie się zastanawiać, czy to właśnie Olek nie wykradł za pomocą jej hasła danych z firmy Artura. Aleksander przysięgnie, że nie ma nic wspólnego z włamaniem do systemu. Wekslerowa zacznie się wahać, czy nie powiedzieć Arturowi i pokrewieństwie Olka z prezesem Marker Trader. Oprócz tego w najnowszym epizodzie ""Pierwszej miłości"" Asia otrzyma od losu szansę na wykazanie się w nowym miejscu pracy. Pod nieobecność Anety do galerii przyjdą potencjalni klienci. Aśka postanawia wykazać się i dokonać pierwszej w swoim życiu transakcji sprzedaży obrazu. Najnowszy odcinek serialu ""Pierwsza miłość"" zostanie wyemitowany 24 kwietnia o godzinie 18:00 na antenie Polsatu. Powtórkę przewidziano na następny dzień o 14:00. Produkcję można śledzić online za pośrednictwem platformy Ipla."
